seq,dssp3,dssp8,disorder
S V A A D L P A L P G G P A G G T G E L A K Y G L P G V A Q L R S R E S Y V L S Y D P R T R G A L W V L E Q L R P E R L R G D G D R S A C D F R E D D S V H A Y H R A T N A D Y R G S G F D R G A L A A A A N H R W S Q R A M D D T F Y L S N V A P Q V P H L N Q N A W N N L E R Y S R S L T R T Y Q N V Y V C T G P L F L P R T E A D G K S Y V K Y Q V I G K N H V A V P T H F F K V L I L E A A G G Q I E L R S Y V M P N A P V D E T I P L E R F L V P I E S I E R A S G L L F V P N I L A R A G N L K A I T A G S K,C C C C C C C C C C C C C C C C C C C C C C C C C C C C C E E E E C C C C E E E E E C C C C E E E E E E E E E E C C E C C C C C C C C C C C C E C C C C C C H H H C C C H H H H C C C C C E E E E C C C H H H C C C C H H H H H H C C E H H H E E E E C H H H H H C H H H H H H H H H H H H H H C C C E E E E E E E E E C C C E E C C C C C E E E E E E E E C C C C E E C C C E E E E E E E E E C C C C C E E E E E E E E E C C C C C C C C C H H H H E C C H H H H H H H H C C C C H H H H H H H C C C C C C C C C C C C,C C C C C C C C C C C C C C C C C C C T T T T C C S C C C E E E E C S S C E E E E E T T T T E E E E E E E E E B T T B T C C S C C C C T T C C B C C T T S C G G G C C C H H H H T T S S C E E E E S S C G G G C T T C H H H H H H T T B G G G E E E E C H H H H H T H H H H H H H H H H H G G G T S S E E E E E E E E E C C C E E C T T S C E E E E E E E E T T T T E E C C S E E E E E E E E E C S S S C E E E E E E E E E S S C C C T T S C G G G G B C C H H H H H H H H S C C C H H H H H H H T C C C C C C C C C C C,0.0 0.0 0.0 0.0 0.0 0.0 0.0 0.0 0.0 0.0 0.0 0.0 0.0 0.0 0.0 0.0 0.0 1.0 1.0 1.0 1.0 1.0 1.0 1.0 1.0 1.0 1.0 1.0 1.0 1.0 1.0 1.0 1.0 1.0 1.0 1.0 1.0 1.0 1.0 1.0 1.0 1.0 1.0 1.0 1.0 1.0 1.0 1.0 1.0 1.0 1.0 1.0 1.0 1.0 1.0 1.0 1.0 1.0 1.0 1.0 1.0 1.0 1.0 1.0 1.0 1.0 1.0 1.0 1.0 1.0 1.0 1.0 1.0 1.0 1.0 1.0 1.0 1.0 1.0 1.0 1.0 1.0 1.0 1.0 1.0 1.0 1.0 1.0 1.0 1.0 1.0 1.0 1.0 1.0 1.0 1.0 1.0 1.0 1.0 1.0 1.0 1.0 1.0 1.0 1.0 1.0 1.0 1.0 1.0 1.0 1.0 1.0 1.0 1.0 1.0 1.0 1.0 1.0 1.0 1.0 1.0 1.0 1.0 1.0 1.0 1.0 1.0 1.0 1.0 1.0 1.0 1.0 1.0 1.0 1.0 1.0 1.0 1.0 1.0 1.0 1.0 1.0 1.0 1.0 1.0 1.0 1.0 1.0 1.0 1.0 1.0 1.0 1.0 1.0 1.0 1.0 1.0 1.0 1.0 1.0 1.0 1.0 1.0 1.0 1.0 1.0 1.0 1.0 1.0 1.0 1.0 1.0 1.0 1.0 1.0 1.0 1.0 1.0 1.0 1.0 1.0 1.0 1.0 1.0 1.0 1.0 1.0 1.0 1.0 1.0 1.0 1.0 1.0 1.0 1.0 1.0 1.0 1.0 1.0 1.0 1.0 1.0 1.0 1.0 1.0 1.0 1.0 1.0 1.0 1.0 1.0 1.0 1.0 1.0 1.0 1.0 1.0 1.0 1.0 1.0 1.0 1.0 1.0 1.0 1.0 1.0 1.0 1.0 1.0 1.0 1.0 1.0 1.0 1.0 1.0 1.0 1.0 1.0 1.0 1.0 1.0 1.0 1.0 0.0 0.0 0.0 0.0 0.0 0.0 0.0 0.0 0.0 0.0
D E D E D D L Q R Y I D V T R G E L F F A R G I I F V E G D A E R F L I P A F A E A L D I H L D I L G I S V C S V S G T N F A P Y I K L V G P T G L N I P H V V L T D L D P V D D R P P L A R K R L L R L L E L A V T D E E W D E L D E D E P W D L G E E Y G Y F V N D S T L E P E L F Q A G L G S G I R D V I E S E L S T S A Q T R E A L A C W V D D P T A L N N E R L L K L I E R I G K G R F A Q A L A G F A T A D T C P A Y I R N A L E Y I R D A V A L E H H H H H H,C C C C C C C C C C C C C C C C C C C C C C E E E E E C C H H H H H H H H H H H H H C C C C H H H H C E E E E E C C C C C C H H H H H H H C C C C C C C C E E E E E C C C C E C C E C C H H H H H H H H H H H C C C C C C C C C C C C C C C C H H H H H H C C E E E C C C C H H H H H H H C C C H H H H H H H H H H H C C C C H H H H H H H H H H H H C H H H C C H H H H H H H H H H H C H H H H H H H H H C C C C H H H C C H H H H H H H H H H H H H H C C C C C C C C C,C C C C C C C C C C C C C C C C C C C C C S E E E E E S S H H H H H H H H H H H H H T T C C H H H H T E E E E E C S S S C C H H H H H H H S T T T T C C C E E E E E C C C C B T T B C C H H H H H H H H H H H T T S C T T C C C T T T T T C C H H H H H H T T E E E C S S C H H H H H H H T T T H H H H H H H H H H H S C C C H H H H H H H H H H H H C G G G C C H H H H H H H H H H H C H H H H H H H H H T T C C G G G S C H H H H H H H H H H H H H H C C C C C C C C C,0.0 0.0 0.0 0.0 0.0 0.0 0.0 0.0 0.0 0.0 0.0 0.0 0.0 0.0 0.0 0.0 0.0 0.0 1.0 1.0 1.0 1.0 1.0 1.0 1.0 1.0 1.0 1.0 1.0 1.0 1.0 1.0 1.0 1.0 1.0 1.0 1.0 1.0 1.0 1.0 1.0 1.0 1.0 1.0 1.0 1.0 1.0 1.0 1.0 1.0 1.0 1.0 1.0 1.0 1.0 1.0 1.0 1.0 1.0 1.0 1.0 1.0 1.0 1.0 1.0 1.0 1.0 1.0 1.0 1.0 1.0 1.0 1.0 1.0 1.0 1.0 1.0 1.0 1.0 1.0 1.0 1.0 1.0 1.0 1.0 1.0 1.0 1.0 1.0 1.0 1.0 1.0 1.0 1.0 1.0 1.0 1.0 1.0 1.0 1.0 1.0 1.0 1.0 1.0 1.0 1.0 1.0 1.0 1.0 1.0 1.0 1.0 1.0 1.0 1.0 1.0 1.0 1.0 1.0 1.0 1.0 1.0 1.0 1.0 1.0 1.0 1.0 1.0 1.0 1.0 1.0 1.0 1.0 1.0 1.0 1.0 1.0 1.0 1.0 1.0 1.0 1.0 1.0 1.0 1.0 1.0 1.0 1.0 1.0 1.0 1.0 1.0 1.0 1.0 1.0 1.0 1.0 1.0 1.0 1.0 1.0 1.0 1.0 1.0 1.0 1.0 1.0 1.0 1.0 1.0 1.0 1.0 1.0 1.0 1.0 1.0 1.0 1.0 1.0 1.0 1.0 1.0 1.0 1.0 1.0 1.0 1.0 1.0 1.0 1.0 1.0 1.0 1.0 1.0 1.0 1.0 1.0 1.0 1.0 1.0 1.0 1.0 1.0 1.0 1.0 1.0 1.0 1.0 1.0 1.0 1.0 1.0 1.0 1.0 1.0 1.0 1.0 1.0 1.0 1.0 1.0 1.0 0.0 0.0 0.0 0.0 0.0 0.0 0.0 0.0
G M E P R A V A D A L E T G E E D A V T E A L R S F N R E H S Q S F T F D D A Q Q E D R K R L A K L L V S V L E Q G L S P K H R V T W L Q T I R I L S R D R S C L D S F A S R Q S L H A L A C Y A D I A I S E E P I P Q P P D M D V L L E S L K C L C N L V L S S P T A Q M L A A E A R L V V R L A E R V G L Y R K R S Y P H E V Q F F D L R L L F L L T A L R T D V R Q Q L F Q E L H G V R L L T D A L E L T L G V A P K E N P L V I L P A Q E T E R A M E I L K V L F N I T F D S V K R E V D E E D A A L Y R Y L G T L L R H C V M A D A A G D R T E E F H G H T V N L L G N L P L K C L D V L L A L E L H E G S L E F M G V N M D V I N A L L A F L E K R L H Q T H R L K E C V A P V L S V L T E C A R M H R P A R K F L K A Q V L P P L R D V R T R P E V G D L L R N K L V R L M T H L D T D V K R V A A E F L F V L C S E S V P R F I K Y T G Y G N A A G L L A A R G L M A G G R P E G Q Y S E D E D T D T E E Y R E A K A S I,C C C H H H H H H H H H H C C H H H H H H H H H H H H H H H C C C C C C C H H H H H H H H H H H H H H H H H H C C C C C C C C H H H H H H H H H H H H C C C C C H H H H C C H H H H H H H H H H C C C C C C C C C C C C C C C H H H H H H H H H H H H H H H H C C H H H H H H H H H C C H H H H H H H H H H C C C C C C C C H H H H H H H H H H H H H H H H H C H H H H H H H H H C C C H H H H H H H H H H H H H C C C C C C C C C C C C C H H H H H H H H H H H H H H H H H H C C C C C C C C C H H H H H H H H H H H H H H H H H H C C C C C C C C H H H H H H H H H H H H C C C C H H H H H H H H C C C C C C C C C E E C C E E C H H H H H H H H H H H H H C C C C C C H H H H C H H H H H H H H H H H H H C H H H H H H H H H H H C C C C C C C C C C C C C C C C H H H H H H H H C C C C C H H H H H H H H H H H H H H C C C C H H H H H H H H C H H H H H H H H C C C C C C C C C C C C C C C C C C C C C C C C C C C C C C C C C,C C C H H H H H H H H H H C C H H H H H H H H H H H H H H H T T C C S C C G G G H H H H H H H H H H H H H H H T T C C C S T T H H H H H H H H H H H H S C T T T G G G G C S H H H H H H H H H H T T C S C C S S C C S S C C C H H H H H H H H H H H H H H H H T C H H H H H H H H H T T H H H H H H H H H H T T T T S C C C H H H H H H H H H H H H H H H H H C H H H H H H H H H T S C H H H H H H H H H H H H H T C C S C S S C C C C C C H H H H H H H H H H H H H H H H H H S S S C C S S C C H H H H H H H H H H H H H H H H H H T C C C S T T C H H H H H H H H H H H H T T S C G G G G G G G G C C C C C T T C C E E T T E E C H H H H H H H H H H H H H T T C C S C H H H H T H H H H H H H H H H H H H C H H H H H H H H H H H S C C C T T C C S C T T S S S S H H H H H H H H T T C S C H H H H H H H H H H H H H H T T T C H H H H H H H H C H H H H H H H H T T T T C C S C C C C C C C C C C C C C C C C C C C C C C C C C C,1.0 1.0 1.0 1.0 1.0 1.0 1.0 1.0 1.0 1.0 1.0 1.0 1.0 1.0 1.0 1.0 1.0 1.0 1.0 1.0 1.0 1.0 1.0 1.0 1.0 1.0 1.0 1.0 1.0 1.0 1.0 1.0 1.0 1.0 1.0 1.0 1.0 1.0 1.0 1.0 1.0 1.0 1.0 1.0 1.0 1.0 1.0 1.0 1.0 1.0 1.0 1.0 1.0 1.0 1.0 1.0 1.0 1.0 1.0 1.0 1.0 1.0 1.0 1.0 1.0 1.0 1.0 1.0 1.0 1.0 1.0 1.0 1.0 1.0 1.0 1.0 1.0 1.0 1.0 1.0 1.0 1.0 1.0 1.0 1.0 1.0 1.0 1.0 1.0 1.0 1.0 1.0 1.0 1.0 1.0 1.0 1.0 1.0 1.0 1.0 1.0 1.0 1.0 1.0 1.0 1.0 1.0 1.0 1.0 1.0 1.0 1.0 1.0 1.0 1.0 1.0 1.0 1.0 1.0 1.0 1.0 1.0 1.0 1.0 1.0 1.0 1.0 1.0 1.0 1.0 1.0 1.0 1.0 1.0 1.0 1.0 1.0 1.0 1.0 1.0 1.0 1.0 1.0 1.0 1.0 1.0 1.0 1.0 1.0 1.0 1.0 1.0 1.0 1.0 1.0 1.0 1.0 1.0 1.0 1.0 1.0 1.0 1.0 1.0 1.0 1.0 1.0 1.0 1.0 1.0 1.0 1.0 1.0 1.0 1.0 1.0 1.0 1.0 1.0 1.0 1.0 1.0 1.0 1.0 1.0 1.0 1.0 1.0 1.0 1.0 1.0 1.0 1.0 1.0 1.0 1.0 1.0 1.0 1.0 1.0 1.0 1.0 1.0 1.0 1.0 1.0 1.0 1.0 1.0 1.0 1.0 1.0 1.0 1.0 1.0 1.0 1.0 1.0 1.0 1.0 1.0 1.0 1.0 1.0 1.0 1.0 1.0 1.0 1.0 1.0 1.0 1.0 1.0 1.0 1.0 1.0 1.0 1.0 1.0 1.0 1.0 1.0 1.0 1.0 1.0 1.0 1.0 1.0 1.0 1.0 1.0 1.0 1.0 1.0 1.0 1.0 1.0 1.0 1.0 1.0 1.0 1.0 1.0 1.0 1.0 1.0 1.0 1.0 1.0 1.0 1.0 1.0 1.0 1.0 1.0 1.0 1.0 1.0 1.0 1.0 1.0 1.0 1.0 1.0 1.0 1.0 1.0 1.0 1.0 1.0 1.0 1.0 1.0 1.0 1.0 1.0 1.0 1.0 1.0 1.0 1.0 1.0 1.0 1.0 1.0 1.0 1.0 1.0 1.0 1.0 1.0 1.0 1.0 1.0 1.0 1.0 1.0 1.0 1.0 1.0 1.0 1.0 1.0 1.0 1.0 1.0 1.0 1.0 1.0 1.0 1.0 1.0 1.0 1.0 1.0 1.0 1.0 1.0 1.0 1.0 1.0 1.0 1.0 1.0 1.0 1.0 1.0 1.0 1.0 1.0 1.0 1.0 1.0 1.0 1.0 1.0 1.0 1.0 1.0 1.0 1.0 1.0 1.0 1.0 1.0 1.0 1.0 1.0 1.0 1.0 1.0 1.0 1.0 1.0 1.0 1.0 1.0 1.0 1.0 1.0 1.0 1.0 1.0 1.0 1.0 1.0 1.0 1.0 1.0 1.0 1.0 1.0 1.0 1.0 1.0 1.0 1.0 1.0 1.0 1.0 1.0 1.0 1.0 1.0 1.0 1.0 1.0 1.0 1.0 1.0 1.0 1.0 1.0 1.0 1.0 1.0 1.0 1.0 1.0 1.0 1.0 1.0 1.0 1.0 1.0 1.0 1.0 1.0 1.0 1.0 0.0 0.0 0.0 0.0 0.0 0.0 0.0 0.0 0.0 0.0 0.0 0.0 0.0 0.0 0.0 0.0 0.0 0.0 0.0 0.0 0.0 0.0 0.0
S N N W D S H Y G F D K A G E F H M L D H T G F A F P S E V V N G R R V L K T T D N N C W V N V T C L Q L Q F A R F R F K S A G L Q A M W E S Y C T G D V A M F V H W L Y W L T G V D K G Q P S D S E N A L N M L S K Y I V P A G S V T I E R V T H D G C C C S K R V V T A P V V N A S V L K L G V E D G L C P H G L N Y I D K V V V V K G T T I V V N V G K P V V A P S H L F L K G V S Y T T F L D N G N G V A G H Y T V F D H D T G M V H D G D V F V P G D L N V S P V T N V V V S E Q T A V V I K D P V K,C C C C H H H H C C C C H H H H H H C C C H H H C C C E E E E C C E E E E C C C C C C H H H H H H H H H H H H C C C C E C C H H H H H H H H H H H C C C C H H H H H H H H H H H C C C C C C C C C H H H H H H H H H H H E C C C E E E E E E E E C C C C C C E E E E E E C C C E E E C C C E C C C E E E E E C C C C C E E E E E E E E E E E E E E E E C C C C C E C C C H H H E C C C C E E E E E E C C C C C C C C E E E E E E C C C C E E E E C C E E E E C C H H H C C E E E E E E E C C C C C C C C C C C C,C C C C H H H H C S T T H H H H H H S C C G G G C C C E E E E T T E E E E C S C T T T H H H H H H H H H H H H T T C C B S S H H H H H H H H H H H T T C C H H H H H H H H H H H T C C T T S C C C H H H H H H H H G G G B C C C E E E E E E E E C T T S S S E E E E E E C S S E E E S C S B T T C E E E E E C T T S C E E E E E E E E E E E E E E E E C S S S C B C C C G G G B C C C S E E E E E E C C C T T S C C E E E E E E T T T C E E E E T T E E E E C C G G G S C E E E E E E E C C C S S C C C C C C C,1.0 1.0 1.0 1.0 1.0 1.0 1.0 1.0 1.0 1.0 1.0 1.0 1.0 1.0 1.0 1.0 1.0 1.0 1.0 1.0 1.0 1.0 1.0 1.0 1.0 1.0 1.0 1.0 1.0 1.0 1.0 1.0 1.0 1.0 1.0 1.0 1.0 1.0 1.0 1.0 1.0 1.0 1.0 1.0 1.0 1.0 1.0 1.0 1.0 1.0 1.0 1.0 1.0 1.0 1.0 1.0 1.0 1.0 1.0 1.0 1.0 1.0 1.0 1.0 1.0 1.0 1.0 1.0 1.0 1.0 1.0 1.0 1.0 1.0 1.0 1.0 1.0 1.0 1.0 1.0 1.0 1.0 1.0 1.0 1.0 1.0 1.0 1.0 1.0 1.0 1.0 1.0 1.0 1.0 1.0 1.0 1.0 1.0 1.0 1.0 1.0 1.0 1.0 1.0 1.0 1.0 1.0 1.0 1.0 1.0 1.0 1.0 1.0 1.0 1.0 1.0 1.0 1.0 1.0 1.0 1.0 1.0 1.0 1.0 1.0 1.0 1.0 1.0 1.0 1.0 1.0 1.0 1.0 1.0 1.0 1.0 1.0 1.0 1.0 1.0 1.0 1.0 1.0 1.0 1.0 1.0 1.0 1.0 1.0 1.0 1.0 1.0 1.0 1.0 1.0 1.0 1.0 1.0 1.0 1.0 1.0 1.0 1.0 1.0 1.0 1.0 1.0 1.0 1.0 1.0 1.0 1.0 1.0 1.0 1.0 1.0 1.0 1.0 1.0 1.0 1.0 1.0 1.0 1.0 1.0 1.0 1.0 1.0 1.0 1.0 1.0 1.0 1.0 1.0 1.0 1.0 1.0 1.0 1.0 1.0 1.0 1.0 1.0 1.0 1.0 1.0 1.0 1.0 1.0 1.0 1.0 1.0 1.0 1.0 1.0 1.0 1.0 1.0 1.0 1.0 1.0 1.0 1.0 1.0 1.0 1.0 1.0 1.0 1.0 1.0 1.0 1.0 1.0 1.0 1.0 1.0 1.0 1.0 1.0 1.0 1.0 1.0 1.0 1.0 1.0 1.0 1.0 1.0
G S A K D Q V D E L L K G E L V P E N D D A E L T E D Q K K K K K E I M E Q E S L W K N P D F K G Y N K T F Q E L H Q L S K T F A N N Q F R L A L S N Y Q S G V N T I M K N R D W V E Q Y R K E E A E K K R L D E K W Y W Q K V D R K A R E E R V V Y R E K M K A K Q D A L N Y F S K A I N H L D E I K N P D L R E R P E F K R L L S D V Y R S W I M A E Y D L Q N L P Q T I P I L E L Y I E I D D N E K E Y P A H K Y L A S A Y S F E E N M I K K T K G P D D M L F K Y R Y K K N V H L L R A T E L K Y G K D S P E Y K H I V N V I N R D E V I S V A Q,C C C C C C C C C C C C C C C C C C C C C C C C C H H H H H H H H H H H H H H H H C C C C C H H H H H H H H H H H H H H H H H H C C H H H H H H H H H H H H H H H H H H H H H H H H H H H H H H H H C C C C C C C C C H H H H H H H H H H H H H H H H H H H H H H H H H H H H H H H H H H H H H H C C C C H H H H C C H H H H H H H H H H H H H H H H H H H H C C C H H H H H H H H H H H H H C C C H H H C H H H H H H H H H H H H H H H H H H H H H C C C H H H H H H H H H H H H H H H H H H H H H H H C C C C H H H H H H H H H H C C C C C C C C C C,C C C C C C C C C C C C C C C C C C C C C C C C C H H H H H H H H H H H H H H H H T S C C C H H H H H H H H H H H H H H H H H H C C H H H H H H H H H H H H H H H H H H H H H H H H H H H H H H H H T C C C S S C C S H H H H H H H H H H H H H H H H H H H H H H H H H H H H H H H H H H H H H H T C C C H H H H T S H H H H H H H H H H H H H H H H H H H H T T C H H H H H H H H H H H H H S T T G G G C H H H H H H H H H H H H H H H H H H H H H T C C H H H H H H H H H H H H H H H H H H H H H H H C T T S H H H H H H H H H H C C C C C C C C C C,0.0 0.0 0.0 0.0 0.0 0.0 0.0 0.0 0.0 0.0 0.0 0.0 0.0 0.0 0.0 0.0 0.0 0.0 0.0 0.0 0.0 0.0 0.0 1.0 1.0 1.0 1.0 1.0 1.0 1.0 1.0 1.0 1.0 1.0 1.0 1.0 1.0 1.0 1.0 1.0 1.0 1.0 1.0 1.0 1.0 1.0 1.0 1.0 1.0 1.0 1.0 1.0 1.0 1.0 1.0 1.0 1.0 1.0 1.0 1.0 1.0 1.0 1.0 1.0 1.0 1.0 1.0 1.0 1.0 1.0 1.0 1.0 1.0 1.0 1.0 1.0 1.0 1.0 1.0 1.0 1.0 1.0 1.0 1.0 1.0 1.0 1.0 1.0 1.0 1.0 1.0 1.0 1.0 1.0 1.0 1.0 1.0 1.0 1.0 1.0 1.0 1.0 1.0 1.0 1.0 1.0 1.0 1.0 1.0 1.0 1.0 1.0 1.0 1.0 1.0 1.0 1.0 1.0 1.0 1.0 1.0 1.0 1.0 1.0 1.0 1.0 1.0 1.0 1.0 1.0 1.0 1.0 1.0 1.0 1.0 1.0 1.0 1.0 1.0 1.0 1.0 1.0 1.0 1.0 1.0 1.0 1.0 1.0 1.0 1.0 1.0 1.0 1.0 1.0 1.0 1.0 1.0 1.0 1.0 1.0 1.0 1.0 1.0 1.0 1.0 1.0 1.0 1.0 1.0 1.0 1.0 1.0 1.0 1.0 1.0 1.0 1.0 1.0 1.0 1.0 1.0 1.0 1.0 1.0 1.0 1.0 1.0 1.0 1.0 1.0 1.0 1.0 1.0 1.0 1.0 1.0 1.0 1.0 1.0 1.0 1.0 1.0 1.0 1.0 1.0 1.0 1.0 1.0 1.0 1.0 1.0 1.0 1.0 1.0 1.0 1.0 1.0 1.0 1.0 1.0 1.0 1.0 1.0 1.0 1.0 1.0 1.0 1.0 1.0 1.0 1.0 1.0 1.0 1.0 1.0 1.0 1.0 1.0 1.0 1.0 1.0 1.0 1.0 1.0 1.0 1.0 1.0 1.0 1.0 1.0 1.0 1.0 1.0 1.0 1.0 1.0 1.0 1.0 1.0 1.0 0.0 0.0 0.0 0.0 0.0 0.0 0.0 0.0 0.0
G S A E S A I S D I S G S Y V V P G T A L Q P L Y Q A L D L P A E I V A R A G R L T A T V K V S Q V D G R I D C E T L L G N K T F R T S F V D G A V L E T N G P E R H N L S F D A S Q S T M A A G P F S L T Y A A S A A G L E V R Y V A A G L D H R A V F A P G V S P R S A P G E V T A F C S A L Y R F N R E A Q R L S L T G N F W F H P E G L L G P F A P F S P G H V W E S A,C C C C C C C C C C C E E E E E E H H H H H H H H H H C C C C H H H H H H H H C C E E E E E E E E E C C E E E E E E E E C C E E E E E E E E C C C E C C E C C C C C C E C E E E H H H C E E E E C C E E E E E E E E C C E E E E E E E E C C E E E E E E E C E C C C C C C C H H H H H H H H H H H H H H H H H C C C C C C C C C E C C C H H H H C C C C C C C C C C C C C C C C,C C C C C C C C C C C E E E E E E G G G G H H H H H H T T C C H H H H H H H H T C E E E E E E E E E T T E E E E E E E E T T E E E E E E E E T T C B C C B C C C C C C B C E E E G G G T E E E E T T E E E E E E E E T T E E E E E E E E T T E E E E E E E C B S C C C C C C H H H H H H H H H H H H H H H H H T T C C C C C C C B C C C H H H H S S T T T T C C C S C S C C C C,0.0 0.0 0.0 0.0 0.0 0.0 1.0 1.0 1.0 1.0 1.0 1.0 1.0 1.0 1.0 1.0 1.0 1.0 1.0 1.0 1.0 1.0 1.0 1.0 1.0 1.0 1.0 1.0 1.0 1.0 1.0 1.0 1.0 1.0 1.0 1.0 1.0 1.0 1.0 1.0 1.0 1.0 1.0 1.0 1.0 1.0 1.0 1.0 1.0 1.0 1.0 1.0 1.0 1.0 1.0 1.0 1.0 1.0 1.0 1.0 1.0 1.0 1.0 1.0 1.0 1.0 1.0 1.0 1.0 1.0 1.0 1.0 1.0 1.0 1.0 1.0 1.0 1.0 0.0 0.0 0.0 0.0 1.0 1.0 1.0 1.0 1.0 1.0 1.0 1.0 1.0 1.0 1.0 1.0 1.0 1.0 1.0 1.0 1.0 1.0 1.0 1.0 1.0 1.0 1.0 1.0 1.0 1.0 1.0 1.0 1.0 1.0 1.0 1.0 1.0 1.0 1.0 1.0 1.0 1.0 1.0 1.0 1.0 1.0 1.0 1.0 1.0 1.0 1.0 1.0 1.0 1.0 1.0 1.0 1.0 1.0 1.0 1.0 1.0 1.0 1.0 1.0 1.0 1.0 1.0 1.0 1.0 1.0 1.0 1.0 1.0 1.0 1.0 1.0 1.0 0.0 0.0 0.0 0.0 1.0 1.0 1.0 1.0 1.0 1.0 1.0 1.0 1.0 1.0 1.0 1.0 1.0 1.0 1.0 1.0 1.0 1.0 1.0 1.0 1.0 1.0 1.0 0.0 0.0
G H M K I N N Y L T V P A H K L D S P T M S R A R I G S D P L A Y E P K E D L P V I T I D P A S,C C C C C C C C C C C C C C C C C C C C C C C C C C C C C C C C C C C C C C C C E E E E E C C C,C C C C C C C S C C C C C C C C C C C C C C C C C C C C C C C C C C C C C C C C E E E E E C C C,0.0 0.0 0.0 0.0 0.0 1.0 1.0 1.0 1.0 1.0 1.0 1.0 1.0 0.0 0.0 0.0 0.0 0.0 0.0 0.0 0.0 0.0 0.0 0.0 0.0 0.0 0.0 0.0 0.0 0.0 0.0 0.0 0.0 0.0 0.0 0.0 0.0 1.0 1.0 1.0 1.0 1.0 1.0 1.0 1.0 1.0 1.0 1.0
M P G G K K V A G G G S S G A T P T S A A A T A P S G V R R L E T S E G T S A Q R D E E P E E E G E E D L R D G G V P F F V N R G G L P V D E A T W E R M W K H V A K I H P D G E K V A Q R I R G A T D L P K I P I P S V P T F Q P S T P V P E R L E A V Q R Y I R E L Q Y N H T G T Q F F E I K K S R P L T G L M D L A K E M T K E A L P I K A L E A V I L G I Y L T N S M P T L E R F P I S F K T Y F S G N Y F R H I V L G V N F A G R Y G A L G M S R R E D L M Y K P P A F R T L S E L V L D F E A A Y G R C W H V L K K V K L G Q S V S H D P H S V E Q I E W K H S V L D V E R L G R D D F R K E L E R H A R D M R L K I G K G T G P P S P T D V L F Q,C C C C C C C C C C C C C C C C C C C C C C C C C C C C C C C C C C C C C C C C C C C C C C C C C C C C C C C C C C C C C E C C C C C C C C H H H H H H H H H H H H H H C C C H H H H H H H H C C C C C C C C C C C C C C C C C C C C C C H H H H H H H H H H H H H H C C E C C C C C E C C C C C C C C C H H H H H H H H H H H H H H C C C E C H H H H H H H H H H C C C C C C C E E E E E E E E E E E E C C E E E E E E E E E E E E C C E E E E E C C C C C H H H C C E E E E E C C H H H H H H H H H H H H H H C C C E E E E E E E C C C C C C C C C C C C C C C C C C E E E E H H H H C H H H H H H H H H H H H H H H H H C C C C C C C C C C C C C C C C C,C C C C C C C C C C C C C C C C C C C C C C C C C C C C C C C C C C C C C C C C C C C C C C C C C C C C C C C C C C C C C B C C S C S S C C H H H H H H H H H H H H H H S T T H H H H H H H H T T C S S C C C C C C C C C C C C C T T S C H H H H H H H H H H H H H H T C B C C S S C B S S C C C T T S C H H H H H H H H H H H H H H C C C B C H H H H H H H H H H T T T T C T T E E E E E E E E E E E E T T E E E E E E E E E E E E T T E E E E E C C C S S G G G S C E E E E E S S H H H H H H H H H H H H H H T T C E E E E E E E C C C C C S C T T C C C C C C S C S E E E E H H H H C H H H H H H H H H H H H H H H H H C C C C C C C C C C C C C C C C C,0.0 0.0 0.0 0.0 0.0 0.0 0.0 0.0 0.0 0.0 0.0 0.0 0.0 0.0 0.0 0.0 0.0 0.0 0.0 0.0 0.0 0.0 0.0 0.0 0.0 0.0 0.0 0.0 0.0 0.0 0.0 0.0 0.0 0.0 0.0 0.0 0.0 0.0 0.0 0.0 0.0 0.0 0.0 0.0 0.0 0.0 0.0 0.0 0.0 0.0 0.0 0.0 0.0 0.0 0.0 0.0 0.0 0.0 0.0 0.0 1.0 1.0 1.0 1.0 1.0 1.0 1.0 1.0 1.0 1.0 1.0 1.0 1.0 1.0 1.0 1.0 1.0 1.0 1.0 1.0 1.0 1.0 1.0 1.0 1.0 1.0 1.0 1.0 1.0 1.0 1.0 1.0 1.0 1.0 1.0 1.0 1.0 1.0 1.0 1.0 1.0 1.0 1.0 1.0 1.0 1.0 1.0 1.0 1.0 1.0 1.0 1.0 1.0 1.0 1.0 1.0 1.0 1.0 1.0 1.0 1.0 1.0 1.0 1.0 1.0 1.0 1.0 1.0 1.0 1.0 1.0 1.0 1.0 1.0 1.0 1.0 1.0 1.0 1.0 1.0 1.0 1.0 1.0 1.0 1.0 1.0 1.0 1.0 1.0 1.0 1.0 1.0 1.0 1.0 1.0 1.0 1.0 1.0 1.0 1.0 1.0 1.0 1.0 1.0 1.0 1.0 1.0 1.0 1.0 1.0 1.0 1.0 1.0 1.0 1.0 1.0 1.0 1.0 1.0 1.0 1.0 1.0 1.0 1.0 1.0 1.0 1.0 1.0 1.0 1.0 1.0 1.0 1.0 1.0 1.0 1.0 1.0 1.0 1.0 1.0 1.0 1.0 1.0 1.0 1.0 1.0 1.0 1.0 1.0 1.0 1.0 1.0 1.0 1.0 1.0 1.0 1.0 1.0 1.0 1.0 1.0 1.0 1.0 1.0 1.0 1.0 1.0 1.0 1.0 1.0 1.0 1.0 1.0 1.0 1.0 1.0 1.0 1.0 1.0 1.0 1.0 1.0 1.0 1.0 1.0 1.0 1.0 1.0 1.0 1.0 1.0 1.0 1.0 1.0 1.0 1.0 1.0 1.0 1.0 1.0 1.0 1.0 1.0 1.0 1.0 1.0 1.0 1.0 1.0 1.0 1.0 1.0 1.0 1.0 1.0 1.0 1.0 1.0 1.0 1.0 1.0 1.0 1.0 1.0 1.0 1.0 1.0 1.0 1.0 1.0 1.0 1.0 1.0 1.0 1.0 1.0 1.0 1.0 1.0 1.0 1.0 1.0 1.0 1.0 0.0 0.0 0.0 0.0 0.0 0.0 0.0 0.0 0.0 0.0 0.0 0.0 0.0 0.0 0.0 0.0
M A E P R Q E F E V M E D H A G T Y G L G D R K D Q G G Y T M H Q D Q E G D T D A G L K E S P L Q T P T E D G S E E P G S E T S D A K S T P T A E D V T A P L V D E G A P G K Q A A A Q P H T E I P E G T T A E E A G I G D T P S L E D E A A G H V T Q A R M V S K S K D G T G S D D K K A K G A D G K T K I A T P R G A A P P G Q K G Q A N A T R I P A K T P P A P K T P P S S G E P P K S G D R S G Y S S P G S P G T P G S R S R T P S L P T P P T R E P K K V A V V R T P P K S P S S A K S R L Q T A P V P M P D L K N V K S K I G S T E N L K H Q P G G G K V Q I I N K K L D L S N V Q S K C G S K D N I K H V P G G G S V Q I V Y K P V D L S K V T S K C G S L G N I H H K P G G G Q V E V K S E K L D F K D R V Q S K I G S L D N I T H V P G G G N K K I E T H K L T F R E N A K A K T D H G A E I V Y K S P V V S G D T S P R H L S N V S S T G S I D M V D S P Q L A T L A D E V S A S L A K Q G L,C C C C C C C C C C C C C C C C C C C C C C C C C C C C C C C C C C C C C C C C C C C C C C C C C C C C C C C C C C C C C C C C C C C C C C C C C C C C C C C C C C C C C C C C C C C C C C C C C C C C C C C C C C C C C C C C C C C C C C C C C C C C C C C C C C C C C C C C C C C C C C C C C C C C C C C C C C C C C C C C C C C C C C C C C C C C C C C C C C C C C C C C C C C C C C C C C C C C C C C C C C C C C C C C C C C C C C C C C C C C C C C C C C C C C C C C C C C C C C C C C C C C C C C C C C C C C C C C C C C C C C C C C C C C C C C C C C C C C C C C C C C C C C C C C C C C C C C C C C C C C C C C C E E E E E C C E E C C E E E E E E C C E E E E E E C C C C C C E E E E E E E E E E C C C E E E E E E E E C C E E E C C C C C C E E E E E E E E E E C C C C C C C C C C C C C C C C C C C C C C C C C C C C C C C C C C C C C C C C C C C C C C C C C C C C C C C C C C C C C C C,C C C C C C C C C C C C C C C C C C C C C C C C C C C C C C C C C C C C C C C C C C C C C C C C C C C C C C C C C C C C C C C C C C C C C C C C C C C C C C C C C C C C C C C C C C C C C C C C C C C C C C C C C C C C C C C C C C C C C C C C C C C C C C C C C C C C C C C C C C C C C C C C C C C C C C C C C C C C C C C C C C C C C C C C C C C C C C C C C C C C C C C C C C C C C C C C C C C C C C C C C C C C C C C C C C C C C C C C C C C C C C C C C C C C C C C C C C C C C C C C C C C C C C C C C C C C C C C C C C C C C C C C C C C C C C C C C C C C C C C C C C C C C C C C C C C C C C C C C C C C C C C C C E E E E E C C E E C C E E E E E E S C E E E E E E C C C C S C E E E E E E E E E E C S C E E E E E E E E S C E E E C C S C C C E E E E E E E E E E C C C C C C C C C C C C C C C C C C C C C C C C C C C C C C C C C C C C C C C C C C C C C C C C C C C C C C C C C C C C C C C,0.0 0.0 0.0 0.0 0.0 0.0 0.0 0.0 0.0 0.0 0.0 0.0 0.0 0.0 0.0 0.0 0.0 0.0 0.0 0.0 0.0 0.0 0.0 0.0 0.0 0.0 0.0 0.0 0.0 0.0 0.0 0.0 0.0 0.0 0.0 0.0 0.0 0.0 0.0 0.0 0.0 0.0 0.0 0.0 0.0 0.0 0.0 0.0 0.0 0.0 0.0 0.0 0.0 0.0 0.0 0.0 0.0 0.0 0.0 0.0 0.0 0.0 0.0 0.0 0.0 0.0 0.0 0.0 0.0 0.0 0.0 0.0 0.0 0.0 0.0 0.0 0.0 0.0 0.0 0.0 0.0 0.0 0.0 0.0 0.0 0.0 0.0 0.0 0.0 0.0 0.0 0.0 0.0 0.0 0.0 0.0 0.0 0.0 0.0 0.0 0.0 0.0 0.0 0.0 0.0 0.0 0.0 0.0 0.0 0.0 0.0 0.0 0.0 0.0 0.0 0.0 0.0 0.0 0.0 0.0 0.0 0.0 0.0 0.0 0.0 0.0 0.0 0.0 0.0 0.0 0.0 0.0 0.0 0.0 0.0 0.0 0.0 0.0 0.0 0.0 0.0 0.0 0.0 0.0 0.0 0.0 0.0 0.0 0.0 0.0 0.0 0.0 0.0 0.0 0.0 0.0 0.0 0.0 0.0 0.0 0.0 0.0 0.0 0.0 0.0 0.0 0.0 0.0 0.0 0.0 0.0 0.0 0.0 0.0 0.0 0.0 0.0 0.0 0.0 0.0 0.0 0.0 0.0 0.0 0.0 0.0 0.0 0.0 0.0 0.0 0.0 0.0 0.0 0.0 0.0 0.0 0.0 0.0 0.0 0.0 0.0 0.0 0.0 0.0 0.0 0.0 0.0 0.0 0.0 0.0 0.0 0.0 0.0 0.0 0.0 0.0 0.0 0.0 0.0 0.0 0.0 0.0 0.0 0.0 0.0 0.0 0.0 0.0 0.0 0.0 0.0 0.0 0.0 0.0 0.0 0.0 0.0 0.0 0.0 0.0 0.0 0.0 0.0 0.0 0.0 0.0 0.0 0.0 0.0 0.0 0.0 0.0 0.0 0.0 0.0 0.0 0.0 0.0 0.0 0.0 0.0 0.0 0.0 0.0 0.0 0.0 0.0 0.0 0.0 0.0 0.0 0.0 0.0 0.0 0.0 0.0 0.0 0.0 0.0 0.0 0.0 0.0 0.0 0.0 0.0 0.0 0.0 0.0 0.0 0.0 0.0 0.0 0.0 0.0 0.0 0.0 0.0 0.0 0.0 0.0 0.0 0.0 0.0 0.0 1.0 1.0 1.0 1.0 1.0 1.0 1.0 1.0 1.0 1.0 1.0 1.0 1.0 1.0 1.0 1.0 1.0 1.0 1.0 1.0 1.0 1.0 1.0 1.0 1.0 1.0 1.0 1.0 1.0 1.0 1.0 1.0 1.0 1.0 1.0 1.0 1.0 1.0 1.0 1.0 1.0 1.0 1.0 1.0 1.0 1.0 1.0 1.0 1.0 1.0 1.0 1.0 1.0 1.0 1.0 1.0 1.0 1.0 1.0 1.0 1.0 1.0 1.0 1.0 1.0 1.0 1.0 1.0 1.0 1.0 1.0 1.0 1.0 1.0 1.0 0.0 0.0 0.0 0.0 0.0 0.0 0.0 0.0 0.0 0.0 0.0 0.0 0.0 0.0 0.0 0.0 0.0 0.0 0.0 0.0 0.0 0.0 0.0 0.0 0.0 0.0 0.0 0.0 0.0 0.0 0.0 0.0 0.0 0.0 0.0 0.0 0.0 0.0 0.0 0.0 0.0 0.0 0.0 0.0 0.0 0.0 0.0 0.0 0.0 0.0 0.0 0.0 0.0 0.0 0.0 0.0 0.0 0.0 0.0 0.0 0.0 0.0
G S H M G T E D L K Y S L E R L R E I L E R L E E N P S E K Q I V E A I R A I V E N N A Q I V E A I R A I V E N N A Q I V E N N R A I I E N N E A I G G G T K Q L E E M K K Q L K D L K R S L E R G,C C C C C C H H H H H H H H H H H H H H H H H H H C C C H H H H H H H H H H H H H H H H H H H H H H H H H H H H C H H H H H H H H H H H H H H H H H H H H H H H H H H H H H H H H H H H H C C C C C,C C C C C C H H H H H H H H H H H H H H H H H H H S C C H H H H H H H H H H H H H H H H H H H H H H H H H H H H T H H H H H H H H H H H H H H H H H H H H H H H H H H H H H H H H H H H H C C C C C,0.0 0.0 0.0 0.0 0.0 1.0 1.0 1.0 1.0 1.0 1.0 1.0 1.0 1.0 1.0 1.0 1.0 1.0 1.0 1.0 1.0 1.0 1.0 1.0 1.0 1.0 1.0 1.0 1.0 1.0 1.0 1.0 1.0 1.0 1.0 1.0 1.0 1.0 1.0 1.0 1.0 1.0 1.0 1.0 1.0 1.0 1.0 1.0 1.0 1.0 1.0 1.0 1.0 1.0 1.0 1.0 1.0 1.0 1.0 1.0 1.0 1.0 1.0 1.0 1.0 1.0 1.0 1.0 1.0 1.0 1.0 1.0 1.0 1.0 1.0 1.0 1.0 1.0 1.0 1.0 1.0 1.0 1.0 1.0 1.0 1.0 1.0 1.0 1.0 1.0 1.0 1.0 1.0 1.0 0.0 0.0 0.0 0.0
