seq,dssp3,dssp8,disorder
M G H H H H H H L R K E V E N H Y K L S L P E D F Y H F W K F C E E L D P E K P S D S L S A S L G L Q L V G P Y D I L A G K H K T K K K S T G L N F N L H W R F Y Y D P P E F Q T I I I G D N K T Q Y H M G Y F R D S P D E F P V Y V G I N E A K K N C I I V P N G D N V F A A V K L F L T K K L K E I T D K K K I N L L K N I D E K L T E A A R E L G Y S L E Q R T V K M K Q R D K K V V T K T F H G A G L V V P V D K N D V G Y R E L P E T D A D L K R I C K T I V E A A S D E E R L K A F A P I Q E M M T F V Q F A N D E C D Y G M G L E L G M D L F C Y G S H Y F H K V A G Q L L P L A Y N L L K R N L F A E I I E E H L A N R S Q E N I D Q L A A,C C C C C C C C C H H H H H H H H C C C C C H H H H H H H H H H H H H C C C C H H H C C H H H H C C E E C C H H H H H C C C C C C C C C C C C C C C C C C C C C C C C C C C E E E E E E C C C C C C E E E E E E C C C C C C C C C E E E E E E C C C C C C C E E C C C C H H H H H H H H H H H H H C C C C C H H H H H H H H H H H H H H H H H H H H H C C C C C C C C H H H H H H H C C C C E C C C C C C C E C C C C C C C C C C C C C C C C C H H H H H H H H H H H H C C C C H H H H H H H C H H H H H H H H H H H H H H H C C C C H H H H H H H H H H H H H C C H H H H H H H H H H H H H H H H H C C C H H H H H H H H H H H H C C C C C C C C C C C C,C C C C C C C T T H H H H H H H H S S C C C H H H H H H H H H H H H H C T T C G G G T T H H H H S C E E C T H H H H H T T T T C C C C C C C C C C T T S T T C C T T C C T T E E E E E E C C T T T T E E E E E E C S S T T S C C S E E E E E E T T T C S C C E E C C S S H H H H H H H H H H H H H T T C C C H H H H H H H H H H H H H H H H H H H H H T C C C C S S C H H H H H H H T T C S B C C T T S S C B C C C C C T T C T T C C C C S S C H H H H H H H H H H H H T C S S H H H H H H H T H H H H H H H H H H H H H H H T T C T H H H H H H H H H H H H H C C G G G H H H H H H H H H H H H H H T T C H H H H H H H H H H H H T C C S C C C T T C C C,0.0 0.0 0.0 0.0 0.0 0.0 1.0 1.0 1.0 1.0 1.0 1.0 1.0 1.0 1.0 1.0 1.0 1.0 1.0 1.0 1.0 1.0 1.0 1.0 1.0 1.0 1.0 1.0 1.0 1.0 1.0 1.0 1.0 1.0 1.0 1.0 1.0 1.0 1.0 1.0 1.0 1.0 1.0 1.0 1.0 1.0 1.0 1.0 1.0 1.0 1.0 1.0 1.0 1.0 1.0 1.0 1.0 1.0 1.0 1.0 1.0 1.0 1.0 1.0 0.0 0.0 0.0 0.0 0.0 0.0 1.0 1.0 1.0 1.0 1.0 1.0 1.0 1.0 1.0 1.0 1.0 1.0 1.0 1.0 1.0 1.0 1.0 1.0 1.0 1.0 1.0 1.0 1.0 1.0 1.0 1.0 1.0 1.0 1.0 1.0 1.0 1.0 1.0 1.0 1.0 1.0 1.0 1.0 1.0 1.0 1.0 1.0 1.0 1.0 1.0 1.0 1.0 1.0 1.0 1.0 1.0 1.0 1.0 1.0 1.0 1.0 1.0 1.0 1.0 1.0 1.0 1.0 1.0 1.0 1.0 1.0 1.0 1.0 1.0 1.0 1.0 1.0 1.0 1.0 1.0 1.0 1.0 1.0 1.0 1.0 1.0 1.0 1.0 1.0 1.0 1.0 1.0 1.0 1.0 1.0 1.0 1.0 1.0 1.0 1.0 1.0 1.0 1.0 1.0 1.0 1.0 1.0 1.0 1.0 1.0 1.0 1.0 1.0 1.0 1.0 1.0 1.0 1.0 1.0 1.0 1.0 1.0 1.0 1.0 1.0 1.0 1.0 1.0 1.0 1.0 1.0 1.0 1.0 1.0 1.0 1.0 1.0 1.0 1.0 1.0 1.0 1.0 1.0 1.0 1.0 1.0 1.0 1.0 1.0 1.0 1.0 1.0 1.0 1.0 1.0 1.0 1.0 1.0 1.0 1.0 1.0 1.0 1.0 1.0 1.0 1.0 1.0 1.0 1.0 1.0 1.0 1.0 1.0 1.0 1.0 1.0 1.0 1.0 1.0 1.0 1.0 1.0 1.0 1.0 1.0 1.0 1.0 1.0 1.0 1.0 1.0 1.0 1.0 1.0 1.0 1.0 1.0 1.0 1.0 1.0 1.0 1.0 1.0 1.0 1.0 1.0 1.0 1.0 1.0 1.0 1.0 1.0 1.0 1.0 1.0 1.0 1.0 1.0 1.0 1.0 1.0 1.0 1.0 1.0 1.0 1.0 1.0 1.0 1.0 1.0 1.0 1.0 1.0 1.0 1.0 1.0 1.0 1.0 1.0 1.0 1.0 1.0 1.0 1.0 1.0 1.0 1.0 1.0 1.0 1.0 1.0 0.0 0.0
F Q S S A M V L R D G A K F E A Q A G D P T Q A L E T Y K D A M V A S G V T T T R P Q D N D T F T R L T R N D E K D D W L K R G V R S D A A D L Y R Q Q D L N V T L E H D Y W G S S G T G G Y S D L K A H T T M L Q V D A P Y S D G R M F F R S D F V N M N V G S F S T N A D G K W D D N W G T C T L Q D C S G N R S Q S D S G A S V A V G W R N D V W S W D I G T T P M G F N V V D V V G G I S Y S D D I G P L G Y T V N A H R R P I S S S L L A F G G Q K D S P S N T G K K W G G V R A D G V G L S L S Y D K G E A N G V W A S L S G D Q L T G K N V E D N W R V R W M T G Y Y Y K V I N Q N N R R V T I G L N N M I W H Y D K D L S G Y S L G Q G G Y Y S P Q E Y L S F A I P V M W R E R T E N W S W E L G A S G S W S H S R T K T M P R Y P L M N L I P T D W Q E E A A R Q S N D G G S S Q G F G Y T A R A L L E R R V T S N W F V G T A I D I Q Q A K D Y A P S H F L L Y V R Y S A A G W Q G D M D L P P Q P L I P Y A D W X X X X,C C C H H H H H H H H H H H H H H C C C H H H H H H H H H H H H H H H C C C C C C C C C H H H H H H C C C C C C C C C H H H H H H H H H H H H H H H H H C C E E E E E E E E E E E C C C C C C C C E E E E E E E E E E E E E E C C E E E E E E E E E E E E E E E E C C C C C C C C E C C C E E C C C C C C E C C C C E E E E E E E E E E E E E E C C C E E E E E E E C C E C C C C C C E E E E E E E E E E C C C C E E E E E E E E E E C C C C H H H H C C E E C C C C C C C C E E E E E E E E E E E E E E E C C C C C C E E E E E E E E E E E E E E E C E E E E E E E E E E E E E E E E E E E C C C E E E E E E E E E E E E E E C C C C C C E E C C C C C C C C C C E E E E E E E E E E E E E E C C C E E E E E E E E E E E E E E E E C C E E C C C C H H H C C H H H H H H H H C C E E C C E E E E E E E E E E E E E E E E E C C C C E E E E E E E E E E E C C C C C C E E E E E E E E E E C C C C C C C C C C C C C C C C C H H H C C C C C,C C C H H H H H H H H H H H H H H T T C H H H H H H H H H H H H H H H T S C S S C C C S H H H H H H T T S C C T T C C H H H H H H H H H H H H H H H H H C C E E E E E E E E E E E C C C T T T T C E E E E E E E E E E E E E E T T E E E E E E E E E E E E E E E E C C C C T T S C B C C S E E T T T T S C B C S C C E E E E E E E E E E E E E E C S S E E E E E E E S C B T S S S C C E E E E E E E E E E S S S C E E E E E E E E E E C C S S H H H H T C E E C C T T T T C C E E E E E E E E E E E E E E E C C C S T T E E E E E E E E E E E E E E E T E E E E E E E E E E E E E E E E E E E C S S E E E E E E E E E E E E E E S S C C C S E E T T S C C S C C C S E E E E E E E E E E E E E E C S S E E E E E E E E E E E E E E E E C C E E S C S C G G G S C H H H H H H H H T C E E C C E E E E E E E E E E E E E E E E E S S S S E E E E E E E E E E E S S S C C C E E E E E E E E E E S S C C C S C C C S S C C C C C C G G G C C C C C,1.0 1.0 1.0 1.0 1.0 1.0 1.0 1.0 1.0 1.0 1.0 1.0 1.0 1.0 1.0 1.0 1.0 1.0 1.0 1.0 1.0 1.0 1.0 1.0 1.0 1.0 1.0 1.0 1.0 1.0 1.0 1.0 1.0 1.0 1.0 1.0 1.0 1.0 1.0 1.0 1.0 1.0 1.0 1.0 1.0 1.0 1.0 1.0 1.0 1.0 1.0 1.0 1.0 1.0 1.0 1.0 1.0 1.0 1.0 1.0 1.0 1.0 1.0 1.0 1.0 1.0 1.0 1.0 1.0 1.0 1.0 1.0 1.0 1.0 1.0 1.0 1.0 1.0 1.0 1.0 1.0 1.0 1.0 1.0 1.0 1.0 1.0 1.0 1.0 1.0 1.0 1.0 1.0 1.0 1.0 1.0 1.0 1.0 1.0 1.0 1.0 1.0 1.0 1.0 1.0 1.0 1.0 1.0 1.0 1.0 1.0 1.0 1.0 1.0 1.0 1.0 1.0 1.0 1.0 1.0 1.0 1.0 1.0 1.0 1.0 1.0 1.0 1.0 1.0 1.0 1.0 1.0 1.0 1.0 1.0 1.0 1.0 1.0 1.0 1.0 1.0 1.0 1.0 1.0 1.0 1.0 1.0 1.0 1.0 1.0 1.0 1.0 1.0 1.0 1.0 1.0 1.0 1.0 1.0 1.0 1.0 1.0 1.0 1.0 1.0 1.0 1.0 1.0 1.0 1.0 1.0 1.0 1.0 1.0 1.0 1.0 1.0 1.0 1.0 1.0 1.0 1.0 1.0 1.0 1.0 1.0 1.0 1.0 1.0 1.0 1.0 1.0 1.0 1.0 1.0 1.0 1.0 1.0 1.0 1.0 1.0 1.0 1.0 1.0 1.0 1.0 1.0 1.0 1.0 1.0 1.0 1.0 1.0 1.0 1.0 1.0 1.0 1.0 1.0 1.0 1.0 1.0 1.0 1.0 1.0 1.0 1.0 1.0 1.0 1.0 1.0 1.0 1.0 1.0 1.0 1.0 1.0 1.0 1.0 1.0 1.0 1.0 1.0 1.0 1.0 1.0 1.0 1.0 1.0 1.0 1.0 1.0 1.0 1.0 1.0 1.0 1.0 1.0 1.0 1.0 1.0 1.0 1.0 1.0 1.0 1.0 1.0 1.0 1.0 1.0 1.0 1.0 1.0 1.0 1.0 1.0 1.0 1.0 1.0 1.0 1.0 1.0 1.0 1.0 1.0 1.0 1.0 1.0 1.0 1.0 1.0 1.0 1.0 1.0 1.0 1.0 1.0 1.0 1.0 1.0 1.0 1.0 1.0 1.0 1.0 1.0 1.0 1.0 1.0 1.0 1.0 1.0 1.0 1.0 1.0 1.0 1.0 1.0 1.0 1.0 1.0 1.0 1.0 1.0 1.0 1.0 1.0 1.0 1.0 1.0 1.0 1.0 1.0 1.0 1.0 1.0 1.0 1.0 1.0 1.0 1.0 1.0 1.0 1.0 1.0 1.0 1.0 1.0 1.0 1.0 1.0 1.0 1.0 1.0 1.0 1.0 1.0 1.0 1.0 1.0 1.0 1.0 1.0 1.0 1.0 1.0 1.0 1.0 1.0 1.0 1.0 1.0 1.0 1.0 1.0 1.0 1.0 1.0 1.0 1.0 1.0 1.0 1.0 1.0 1.0 1.0 1.0 1.0 1.0 1.0 1.0 1.0 1.0 1.0 1.0 1.0 1.0 1.0 1.0 1.0 1.0 1.0 1.0 1.0 1.0 1.0 1.0 1.0 1.0 1.0 1.0 1.0 1.0 1.0 1.0 1.0 1.0 1.0 1.0 1.0 1.0 1.0 1.0 1.0 1.0 1.0 1.0 1.0 1.0 1.0 1.0 1.0 1.0 1.0 1.0 1.0 1.0 1.0 1.0 1.0 1.0 1.0 1.0 1.0 1.0 1.0 1.0 1.0 1.0 1.0 1.0 0.0 0.0 0.0 0.0
A N G N E G L S T T T K Y I F V P I A T I G C G K T T V F N T L N N L F P Q W T H I Q N N N I S K K A K L K I C D L T L L A L E D D D Q S V V L F D R N N S A S R E R R Q I F T T I D Q K R D E H L D D T V D L K Y I A I N F I P E D L S E E E L W D I T Y N R V I Q R G D N H Q S I K S Q L D E N L V E S V M K G F I Q R Y Q P I N T S R S P D D Q F D H V I H L K L S K D E N S L K S S L E N V R I I I D D L V Q N F P D L I K E K P A D E L I N E C F Q K A L D Y K P T F V K N M T A N T I K K D P T Y Y G I A M H Y S S I L E N L E I V S H N E H F Q N I K S H I Q T E F H V T L G H I A S S K Q D K A G R V K W K K L V K T L G K G D P N K P K S A L K F F A D V K L L Q I V I N T D K L A C I K V E I L K I Y D T N D V L Q S E I E P I N K Q L H I T I G C I P P A T A V E S N I T L E E L Y D N P D E Q E L K P D G T Y K C G D D T L H V F N F D N P D L K L F S Q Q L F V A Y Q,C C C C C C C C C E E E E E E E E E C C C C C C H H H H H H H H H H H C C C C E E E E H H H C C C C C C C C H H H H H H H C C C C C C C C E E E E E C C C C C H H H H H H H H H H H H H H H H H C C C C C E E E E E E E E E C C C C C C C H H H H H H H H H H H H H H H C C C C C C C C C C C C H H H H H H H H H H H H H C C C C C C C C C C C H H H C C E E E E C C C C C C E C C E C H H H H H H H H H H H H H H H H C C C C C C C C C C H H H H H H H H H H H H C C C C C C C C C C C C C C C C C C C C C C C C C C C C C C C C C C C C C C C C C C C C C C C C C C C C C C C C C C C C C C C C C C C C C C C C C C C C C C C C C C C C C C C C C C C C C C C C C C C C C C C C C C C C C C C C C C C C C C C C C C C C C C C C C C C C C C C C C C C C C C C C C C C C C C C C C C C C C C C C C C C C C C C C C C C C C C C C C C C C C C C C C C C C C C C C C C C C C C C C C C C C C C,C C C C C C C C C E E E E E E E E E C C T T S S H H H H H H H H H H H C T T S E E E E G G G S C T T C S S C H H H H H H H T T S S T T C C E E E E E S C C C S H H H H H H H H H H H H H H G G G T C C T T E E E E E E E E E C S C T T C C H H H H H H H H H H H H H H H C C C C T T T T T C S S H H H H H H H H H H H H H T C C C C C T T S T T G G G C S E E E E C C C C C C B T T B C H H H H H H H H H H H H H H H H C T T T C S S C C C H H H H H H H H H H H H T C C C C C C C C C C C C C C C C C C C C C C C C C C C C C C C C C C C C C C C C C C C C C C C C C C C C C C C C C C C C C C C C C C C C C C C C C C C C C C C C C C C C C C C C C C C C C C C C C C C C C C C C C C C C C C C C C C C C C C C C C C C C C C C C C C C C C C C C C C C C C C C C C C C C C C C C C C C C C C C C C C C C C C C C C C C C C C C C C C C C C C C C C C C C C C C C C C C C C C C C C C C C C,0.0 0.0 0.0 0.0 0.0 0.0 1.0 1.0 1.0 1.0 1.0 1.0 1.0 1.0 1.0 1.0 1.0 1.0 1.0 1.0 1.0 1.0 1.0 1.0 1.0 1.0 1.0 1.0 1.0 1.0 1.0 1.0 1.0 1.0 1.0 1.0 1.0 1.0 1.0 1.0 1.0 1.0 1.0 1.0 1.0 1.0 1.0 1.0 1.0 1.0 1.0 1.0 1.0 1.0 1.0 1.0 1.0 1.0 1.0 1.0 1.0 1.0 1.0 1.0 1.0 1.0 1.0 1.0 1.0 1.0 1.0 1.0 1.0 1.0 1.0 1.0 1.0 1.0 1.0 1.0 1.0 1.0 1.0 1.0 1.0 1.0 1.0 1.0 1.0 1.0 1.0 1.0 1.0 1.0 1.0 1.0 1.0 1.0 1.0 1.0 1.0 1.0 1.0 1.0 1.0 1.0 1.0 1.0 1.0 1.0 1.0 1.0 1.0 1.0 1.0 1.0 1.0 1.0 1.0 1.0 1.0 1.0 1.0 1.0 1.0 1.0 1.0 1.0 1.0 1.0 1.0 1.0 1.0 1.0 1.0 1.0 1.0 1.0 1.0 1.0 1.0 1.0 1.0 1.0 1.0 1.0 1.0 1.0 1.0 1.0 1.0 1.0 1.0 1.0 1.0 1.0 1.0 1.0 1.0 1.0 1.0 1.0 1.0 1.0 1.0 1.0 1.0 1.0 1.0 1.0 1.0 1.0 1.0 1.0 1.0 1.0 1.0 1.0 1.0 1.0 1.0 1.0 1.0 1.0 1.0 1.0 1.0 1.0 1.0 1.0 1.0 1.0 1.0 1.0 1.0 1.0 1.0 1.0 1.0 1.0 1.0 1.0 1.0 1.0 1.0 1.0 1.0 1.0 1.0 1.0 1.0 1.0 1.0 1.0 1.0 1.0 1.0 1.0 1.0 1.0 1.0 1.0 1.0 1.0 1.0 1.0 1.0 1.0 1.0 1.0 0.0 0.0 0.0 0.0 0.0 0.0 0.0 0.0 0.0 0.0 0.0 0.0 0.0 0.0 0.0 0.0 0.0 0.0 0.0 0.0 0.0 0.0 0.0 0.0 0.0 0.0 0.0 0.0 0.0 0.0 0.0 0.0 0.0 0.0 0.0 0.0 0.0 0.0 0.0 0.0 0.0 0.0 0.0 0.0 0.0 0.0 0.0 0.0 0.0 0.0 0.0 0.0 0.0 0.0 0.0 0.0 0.0 0.0 0.0 0.0 0.0 0.0 0.0 0.0 0.0 0.0 0.0 0.0 0.0 0.0 0.0 0.0 0.0 0.0 0.0 0.0 0.0 0.0 0.0 0.0 0.0 0.0 0.0 0.0 0.0 0.0 0.0 0.0 0.0 0.0 0.0 0.0 0.0 0.0 0.0 0.0 0.0 0.0 0.0 0.0 0.0 0.0 0.0 0.0 0.0 0.0 0.0 0.0 0.0 0.0 0.0 0.0 0.0 0.0 0.0 0.0 0.0 0.0 0.0 0.0 0.0 0.0 0.0 0.0 0.0 0.0 0.0 0.0 0.0 0.0 0.0 0.0 0.0 0.0 0.0 0.0 0.0 0.0 0.0 0.0 0.0 0.0 0.0 0.0 0.0 0.0 0.0 0.0 0.0 0.0 0.0 0.0 0.0 0.0 0.0 0.0 0.0 0.0 0.0 0.0 0.0 0.0 0.0 0.0 0.0 0.0 0.0 0.0 0.0 0.0 0.0 0.0 0.0 0.0 0.0 0.0 0.0 0.0 0.0 0.0 0.0 0.0 0.0 0.0 0.0 0.0 0.0 0.0 0.0 0.0 0.0 0.0 0.0 0.0 0.0 0.0 0.0 0.0 0.0 0.0 0.0 0.0
H H H H H H H H G S P Y I Q N P D P A V Y Q L R D S K S S D K F V C L F T D F D S Q I N V S Q S K D S D V Y I T D K C V L D M R S M D F K S N S A V A W S N K S D F T C A N A F N N S I I P E D T F F P S P E S S C,C C C C C C C C C C C C C C C C C C E E E E E E E C C C C C C E E E E E E C C C C C C C C C C C C C C C E E E C C C E E E E E H H H C E E E E E E E E E E C C C C C C H H H H C C C C C C C C C C E C C C C C C C C,C C C C C C C C C C C C C C C C C C E E E E E E E S S C T T C E E E E E E S C C T T C C C C C C S S T T E E E C C C E E E E E G G G T E E E E E E E E E E S C T T C C H H H H T T T S C C C T T C B C C C C C C C C,0.0 0.0 0.0 0.0 0.0 0.0 0.0 0.0 0.0 0.0 0.0 0.0 0.0 0.0 1.0 1.0 1.0 1.0 1.0 1.0 1.0 1.0 1.0 1.0 1.0 1.0 1.0 1.0 1.0 1.0 1.0 1.0 1.0 1.0 1.0 1.0 1.0 1.0 1.0 1.0 1.0 1.0 1.0 1.0 1.0 1.0 1.0 1.0 1.0 1.0 1.0 1.0 1.0 1.0 1.0 1.0 1.0 1.0 1.0 1.0 1.0 1.0 1.0 1.0 1.0 1.0 1.0 1.0 1.0 1.0 1.0 1.0 1.0 1.0 1.0 1.0 1.0 1.0 1.0 1.0 1.0 1.0 1.0 1.0 1.0 1.0 1.0 1.0 1.0 1.0 1.0 1.0 1.0 1.0 1.0 1.0 1.0 1.0 1.0 1.0 1.0 1.0 0.0 0.0 0.0 0.0
M Y A D D F D G E I E I D E V D S L V E F L S R R P A F D A N N F V L T F E E S G F P Q L N I F A K N D I A V V Y Y M D I G E N F V S K G N S A S G G T E K F Y E N K L G G E V D L S K D C V V S K E Q M I E A A K Q F F A T K Q R P E Q L T W S E L,C E E E E C C E E E E C C C H H H H H H H C C C C C E C C E E E E E E E C C C C C C C E E E E E E E C C E E E E E E E C C C C E E E E C C C C C C C C E E E E E C C C C C C E E E E E H H H C E E H H H H H H H H H H H H H H C C C C C C C C E E E C,C E E E E T T E E E E C C S H H H H H H H T T C C C B T T E E E E E E E S S T T C C S E E E E E E E T T E E E E E E E C S S C E E E E C C S C S S C C E E E E E S S T T C C E E E E E G G G C E E H H H H H H H H H H H H H H S S C C S S S C E E E C,1.0 1.0 1.0 1.0 1.0 1.0 1.0 1.0 1.0 1.0 1.0 1.0 1.0 1.0 1.0 1.0 1.0 1.0 1.0 1.0 1.0 1.0 1.0 1.0 1.0 1.0 1.0 1.0 1.0 1.0 1.0 1.0 1.0 1.0 1.0 1.0 1.0 1.0 1.0 1.0 1.0 1.0 1.0 1.0 1.0 1.0 1.0 1.0 1.0 1.0 1.0 1.0 1.0 1.0 1.0 1.0 1.0 1.0 1.0 1.0 1.0 1.0 1.0 1.0 1.0 1.0 1.0 1.0 1.0 1.0 1.0 1.0 1.0 1.0 1.0 1.0 1.0 1.0 1.0 1.0 1.0 1.0 1.0 1.0 1.0 1.0 1.0 1.0 1.0 1.0 1.0 1.0 1.0 1.0 1.0 1.0 1.0 1.0 1.0 1.0 1.0 1.0 1.0 1.0 1.0 1.0 1.0 1.0 1.0 1.0 1.0 1.0 1.0 1.0 1.0 1.0 1.0 1.0 1.0 1.0 1.0 1.0 1.0
M G S S H H H H H H S Q D P I G L N G G A N V Y H Y A P N P V G W V D P W G L A G S Y A L G P Y Q I S A P Q L P A Y N G Q T V G T F Y Y V N D A G G L E S K V F S S G G P T P Y P N Y A N A G H V E G Q S A L F M R D N G I S E G L V F H N N P E G T C G F C V N M T E T L L P E N A K M T V V P P E G A I P V K R G A T G E T K V F T G N S N S P K S P T K G G C,C C C C C C C C C C C C C C C C C C C C C C C C C C C C C C C C C C C C C C C C C E E E E C C E E E E C C C C C C C C C C C E E E E E E E C C C C C E E E E E E E C C C C C C C C C C C C C C C H H H H H H H H H H H C C C C E E E E E E C C C C C E C H H H H H H H H H H C C C C C E E E E E C C C C C C C C C C C C E C C C E E E E C C C C C C C C C C C C C C,C C C C C C C C C C C C C C C C C C C C C C C C C C C C C C C C C C C C C C C C C E E E E T T E E E E C C C C C C C S S S C E E E E E E E C T T S C E E E E E E E S S C C C S C T T S T T T T S H H H H H H H H H H H T T C C E E E E E E C C T T C B C H H H H H H H H H H S C T T C E E E E E C C T T C C C C S T T C B S S C E E E E C C S C C C C C C C C C C C,0.0 0.0 0.0 0.0 0.0 0.0 0.0 0.0 0.0 0.0 0.0 0.0 0.0 0.0 0.0 0.0 0.0 0.0 0.0 0.0 0.0 0.0 0.0 0.0 0.0 0.0 0.0 0.0 0.0 0.0 0.0 0.0 0.0 0.0 0.0 0.0 0.0 0.0 0.0 0.0 1.0 1.0 1.0 1.0 1.0 1.0 1.0 1.0 1.0 1.0 1.0 1.0 1.0 1.0 1.0 1.0 1.0 1.0 1.0 1.0 1.0 1.0 1.0 1.0 1.0 1.0 1.0 1.0 1.0 1.0 1.0 1.0 1.0 1.0 1.0 1.0 1.0 1.0 1.0 1.0 1.0 1.0 1.0 1.0 1.0 1.0 1.0 1.0 1.0 1.0 1.0 1.0 1.0 1.0 1.0 1.0 1.0 1.0 1.0 1.0 1.0 1.0 1.0 1.0 1.0 1.0 1.0 1.0 1.0 1.0 1.0 1.0 1.0 1.0 1.0 1.0 1.0 1.0 1.0 1.0 1.0 1.0 1.0 1.0 1.0 1.0 1.0 1.0 1.0 1.0 1.0 1.0 1.0 1.0 1.0 1.0 1.0 1.0 1.0 1.0 1.0 1.0 1.0 1.0 1.0 1.0 1.0 1.0 1.0 1.0 1.0 1.0 1.0 1.0 1.0 1.0 1.0 1.0 1.0 1.0 1.0 1.0 1.0 1.0 1.0 1.0 1.0 1.0 1.0 1.0 1.0 1.0 1.0 0.0 0.0 0.0 0.0 0.0
K S G K P S G E M D E V G V Q K C K N A L K L P V L E V L P G G G W D N L R N V D M G R V M E L T Y S N C R T T E D G Q Y I I P D E I F T I P Q K Q S N L E M N S E I L E S W A N Y Q S S T S Y S I N T E L S L F S K V N G K F S T E F Q R M K T L Q V K D Q A I T T R V Q V R N L V Y T V K I N P T L E L S S G F R K E L L D I S D R L E N N Q T R M A T Y L A E L L V L N Y G T H V T T S V D A G A A L I Q E D H L R A S F L Q D S Q S S R S A V T A S A G L A F Q N T V N F K F E E N Y T S Q N V L T K S Y L S N R T N S R V Q S I G G V P F Y P G I T L Q A W Q Q G I T N H L V A I D R S G L P L H F F I N P N M L P D L P G P L V K K V S K T V E T A V K R Y Y T F N T Y P G C T D L N S P N F N F Q A N T D D G S C E G K M T N F S F G G V Y Q E C T Q L S G N R D V L L C Q K L E Q K N P L T G D F S C P S G Y S P V H L L S Q I H E E G Y N H L E C H R K C T L K V F C K T V C E D V F Q V A K A E F R A F W C V A S S Q V P E N S G L L F G G L F S S K S I N P M T N A Q S C P A G Y F P L R L F E N L K V C V S Q D Y E L G S R F A V P F G G F F S C T V G N P L V D P A I S R D L G A P S L K K C P G G F S Q H P A L I S D G C Q V S Y C V K S G L F T G G S L P P A R L P P F T R P P L M S Q A A T N T V I V T N S E N A R S W I K D S Q T H Q W R L G E P I E L R R A M N V I H G D G G G L S H H H H H H,C C C C C C C C C C C C C H H H H H H H H C C C E C C C C C C E E E E C C C C E E E E E C E C C C C C C C C E C C C C C C E C C C C E E E E E E E E E E E E C C C E E E C C C C C C C C C C C H H H H C C C C C C C C C C C C C C H H H H H H H H H H H H C C E E E E E E E E E E E E E E E E E C C C C C E C H H H H H H H H H H H H H H H C C C H H H H H H H H H H H H H H H E C E E E E E E E E E E E E E E E E E E E H H H H C C C C C C H H H H H H H H H H H H H H H H H C C C C C C C C C C C H H H H H H H H H E E E E E E E E E C C C C C C C C C C H H H H H H C C C C C C E E E E E E E E E H H H H C C C C C C C C C C H H H H H H H H H H H H H H H H H H H H C C C C E E C C C C C C C C C C C C C C E E C C C C C C C C C C C C C C C E E E E E E C C C C C C C C C C C C C C C C C C C C C C C C C C C C C C C C C C C C C E E E E E E E E C C E E E C C C C C C C C C C C E E E E E E E E E E E E E E E E E C C C C C C C C C C C C C C C C C C E C C C C C C C C C C C C C C C C C C E E E E C C C C C E E E E C C C C C C H H H H C C C C C E E E C C C C C E C C C C C C C C C C C C C C C E C C C C C C C E E E E C C C C C C C C C E E E E C C C C C C C C C C C C C C C C C C C C C C C C C C C C C E E E E E E E C C C C E E E E C C C C C C C C C E C C H H H H H H H H H H H C C C C C C C C C C C C C C,C C C C C C C C C C C C T H H H H H H H H C C C B C C C C S S E E E E T T T T E E E E E C B C C C C T T C C B C T T S C C B C C T T E E E E E E E E E E E E S S C E E E C C S S S C C C S S S H H H H T S S C T T T T T T T T T S H H H H H H H H H H H H T T E E E E E E E E E E E E E E E E E C S S C C B C H H H H H H H H H H H H H H H T T C H H H H H H H H H H H H H H H B S E E E E E E E E E E E E E E E E E E E H H H H C C C C C C H H H H H H H H H H H H H H H H H S C S S C C C S C C S H H H H H H H H H E E E E E E E E E S S S C C C T T C C H H H H H H T T T T C C E E E E E E E E E G G G G C S T T T C C S S C H H H H H H H H H H H H H H H H H H H H T T C C E E C C C S S S S S C C T T C C E E C S C S S C C C C C C C C C C E E E E E E C S S C C S S S C T T T T T C C C C T T T S S C C C C C C C C C C C C C C E E E E E E E E C C E E E C C C C C C C C C C C E E E E E E E E E E E E E E E E E C C C C C C C C C C C C C C C C C C B C S S S C C T T T T S S S C C T T C E E E E C S S S C E E E E C C C C C C G G G G C C C C C E E E C S S C C B T T C C C C C C C C C C C C C B S S C C T T C E E E E C C C C S S C C C E E E E C C S T T T C S S C C C C C C S C C S C C C C C C S C C C E E E E E E E T T T T E E E E C C T T T C C C C B C C H H H H H H H H H H H C C C C C C C C C C C C C C,0.0 0.0 0.0 0.0 0.0 0.0 0.0 0.0 0.0 0.0 1.0 1.0 1.0 1.0 1.0 1.0 1.0 1.0 1.0 1.0 1.0 1.0 1.0 1.0 1.0 1.0 1.0 1.0 1.0 1.0 1.0 1.0 1.0 1.0 1.0 1.0 1.0 1.0 1.0 1.0 1.0 1.0 1.0 1.0 1.0 1.0 1.0 1.0 1.0 1.0 1.0 1.0 1.0 1.0 1.0 1.0 1.0 1.0 1.0 1.0 1.0 1.0 1.0 1.0 1.0 1.0 1.0 1.0 1.0 1.0 1.0 1.0 1.0 1.0 1.0 1.0 1.0 1.0 1.0 1.0 1.0 1.0 1.0 1.0 1.0 1.0 1.0 1.0 1.0 1.0 1.0 1.0 1.0 1.0 1.0 1.0 1.0 1.0 1.0 1.0 1.0 1.0 1.0 1.0 1.0 1.0 1.0 1.0 1.0 1.0 1.0 1.0 1.0 1.0 1.0 1.0 1.0 1.0 1.0 1.0 1.0 1.0 1.0 1.0 1.0 1.0 1.0 1.0 1.0 1.0 1.0 1.0 1.0 1.0 1.0 1.0 1.0 1.0 1.0 1.0 1.0 1.0 1.0 1.0 1.0 1.0 1.0 1.0 1.0 1.0 1.0 1.0 1.0 1.0 1.0 1.0 1.0 1.0 1.0 1.0 1.0 1.0 1.0 1.0 1.0 1.0 1.0 1.0 1.0 1.0 1.0 1.0 1.0 1.0 1.0 1.0 1.0 1.0 1.0 1.0 1.0 1.0 1.0 1.0 1.0 1.0 1.0 1.0 1.0 1.0 1.0 1.0 1.0 1.0 1.0 1.0 1.0 1.0 1.0 1.0 1.0 1.0 1.0 1.0 1.0 1.0 1.0 1.0 1.0 1.0 1.0 0.0 0.0 1.0 1.0 1.0 1.0 1.0 1.0 1.0 1.0 1.0 1.0 1.0 1.0 1.0 1.0 1.0 1.0 1.0 1.0 1.0 1.0 1.0 1.0 1.0 1.0 1.0 1.0 1.0 1.0 1.0 1.0 1.0 1.0 1.0 1.0 1.0 1.0 1.0 1.0 1.0 1.0 1.0 1.0 1.0 1.0 1.0 1.0 1.0 1.0 1.0 1.0 1.0 1.0 1.0 1.0 1.0 1.0 1.0 1.0 1.0 1.0 1.0 1.0 1.0 1.0 1.0 1.0 1.0 1.0 1.0 1.0 1.0 1.0 1.0 1.0 1.0 1.0 1.0 1.0 1.0 1.0 1.0 1.0 1.0 1.0 1.0 1.0 1.0 1.0 1.0 1.0 1.0 1.0 1.0 1.0 1.0 1.0 1.0 1.0 1.0 1.0 1.0 1.0 1.0 1.0 1.0 1.0 1.0 1.0 1.0 1.0 1.0 1.0 1.0 1.0 1.0 1.0 1.0 1.0 1.0 1.0 1.0 1.0 1.0 1.0 1.0 1.0 1.0 1.0 1.0 1.0 1.0 1.0 1.0 1.0 1.0 1.0 1.0 1.0 1.0 1.0 1.0 1.0 1.0 1.0 1.0 1.0 1.0 1.0 1.0 1.0 1.0 1.0 1.0 1.0 1.0 1.0 1.0 1.0 1.0 1.0 1.0 1.0 1.0 1.0 1.0 1.0 1.0 1.0 1.0 1.0 1.0 1.0 1.0 1.0 1.0 1.0 1.0 1.0 1.0 1.0 1.0 0.0 0.0 0.0 0.0 0.0 0.0 0.0 0.0 1.0 1.0 1.0 1.0 1.0 1.0 1.0 1.0 1.0 1.0 1.0 1.0 1.0 1.0 1.0 1.0 1.0 1.0 1.0 0.0 0.0 0.0 0.0 0.0 0.0 0.0 0.0 1.0 1.0 1.0 1.0 1.0 1.0 1.0 1.0 1.0 1.0 1.0 1.0 1.0 1.0 1.0 1.0 1.0 1.0 1.0 0.0 0.0 0.0 0.0 0.0 0.0 0.0 0.0 0.0 0.0 0.0 1.0 1.0 1.0 1.0 1.0 1.0 1.0 1.0 1.0 1.0 1.0 1.0 1.0 1.0 1.0 1.0 1.0 1.0 1.0 1.0 1.0 1.0 1.0 1.0 1.0 1.0 1.0 1.0 1.0 1.0 1.0 1.0 1.0 1.0 1.0 1.0 1.0 1.0 1.0 0.0 0.0 0.0 0.0 1.0 1.0 1.0 1.0 1.0 1.0 1.0 1.0 1.0 1.0 1.0 1.0 1.0 1.0 1.0 1.0 1.0 1.0 1.0 1.0 1.0 1.0 0.0 0.0 0.0 0.0 0.0 0.0 0.0 0.0 0.0 0.0 0.0 1.0 1.0 1.0 1.0 1.0 1.0 1.0 1.0 1.0 1.0 1.0 1.0 1.0 1.0 1.0 1.0 1.0 1.0 1.0 1.0 1.0 1.0 1.0 1.0 1.0 1.0 1.0 1.0 1.0 1.0 1.0 1.0 1.0 1.0 1.0 1.0 1.0 1.0 1.0 1.0 1.0 1.0 1.0 1.0 1.0 1.0 1.0 1.0 1.0 1.0 1.0 1.0 1.0 1.0 1.0 1.0 1.0 1.0 1.0 1.0 1.0 1.0 1.0 1.0 1.0 1.0 1.0 1.0 1.0 1.0 1.0 1.0 1.0 1.0 1.0 1.0 1.0 1.0 1.0 1.0 1.0 1.0 1.0 1.0 1.0 1.0 1.0 1.0 1.0 1.0 1.0 1.0 1.0 1.0 0.0 0.0 0.0 0.0 0.0 0.0 0.0 0.0 0.0 0.0 0.0 0.0 0.0
A D C A K G K I E F S K Y N E N D T F T V K V A G K E Y W T N R W N L Q P L L Q S A Q L T G M T V T I K S S T C A S G S G F A E V Q F N N D,C E E E E E E E E E E E E C C C C C E E E E E C C E E E E E C C C C H H H H H H H H H H C C C E E E E E C C C C C C C E E E C E E E E E C C,C E E E E E E E E E E E E C T T S C E E E E E T T E E E E E C C T T H H H H H H H H H H T T C E E E E E C S C C S T T E E E C E E E E E C C,1.0 1.0 1.0 1.0 1.0 1.0 1.0 1.0 1.0 1.0 1.0 1.0 1.0 1.0 1.0 1.0 1.0 1.0 1.0 1.0 1.0 1.0 1.0 1.0 1.0 1.0 1.0 1.0 1.0 1.0 1.0 1.0 1.0 1.0 1.0 1.0 1.0 1.0 1.0 1.0 1.0 1.0 1.0 1.0 1.0 1.0 1.0 1.0 1.0 1.0 1.0 1.0 1.0 1.0 1.0 1.0 1.0 1.0 1.0 1.0 1.0 1.0 1.0 1.0 1.0 1.0 1.0 1.0 1.0 1.0
