seq,dssp3,dssp8,disorder
A E I K N V I L M I G D G M G P Q Q V G L L E T Y A N Q A P N S I Y K G N K T A V Y Q L A Q E G V I G S S L T H P E D A I V V D S A C S A T M L A T G I Y S S S E V I G I D S Q G N H V E T V L E K A K K A G K A T G L V S D T R L T H A T P A S F A A H Q P H R S L E N Q I A S D M L A T G A D V M L S G G L R H W I P K S T N D K G E T Y K Q L E K L T Q G D V Y L K S K R K D D R N L L T E A E K D G Y Q L A F N R N M L D D A K G D K L L G L F A Y S G M D D G I A Y S N K K K S G E R T Q P S L K E M T Q K A L N I L S K D E D G F F L M V E G G Q I D W A G H S N D A G T M L H E L L K F D E A I Q T V Y E W A K D R E D T I V I V T A D H E T G S F G F S Y S S N D L P K P Q K L S G E A F A D R D Y A P N F N F G A F D I L D G L Y N Q K Q S Y Y G M I S E F Q K L D K S L Q T P E K L A E I V N K N S E F P I T A E Q A K N V L A S K P N P Y R L A Q H K Y L S A E E V P A I N D F D A F F P Y N D R G N L L A R E Q A T G Q N I V W G T G T H T H T P V N V F A W G P A E K I L P V S K I M H H S E L G E Y I K Q Q V N L A W S H P Q F E K,C C C C E E E E E E E C C C C H H H H H H H H H H H H H C C C C C C C C C C C H H H H H H H H C E E E E E E C C C C C C C C C C H H H H H H H H H H C C C C C C C C E C E C C C C C E C C C H H H H H H H C C C E E E E E E E E E C C C H H H H C C C C C E C C C C C H H H H H H H H H H H C C C E E E E E C H H H C C C H H H H H C C H H H H H H H H H C C C C C C C C C C C C C C C C H H H H H H H C C C E E E C C H H H H H H C C C C C E E E E C C C C C C C C H H H H H H H H H C C C C C C C C H H H H H H H H H H H H C C C C C C E E E E E E E C C H H H H H H C C C H H H H H H H H H H H H H H H H H H H H H H C C C C C E E E E E E E C C E E C C C E E C C E C C C C C C C E C C C C H H H C C C C E C C C C E C C C C H H H H H H H C C C C C H H H H H H H H H H C C H H H C C H H H H H H H H H H H C C C C C C H H H H H H H H C E E E C C C C C C C C C C C C C C E E E C C C C C H H H C C C C C C H H H H H H H H H H H H C E E C C C C C E E C C C E E E E E E C C H H H H H H H C C E E E H H H H H H H H H H C C C C C C C C C C C C C,C C C C E E E E E E E T T C C H H H H H H H H H H H H H C T T C T T T T C C C H H H H H H H H S E E E E E E C C C T T C S S C C H H H H H H H H H H S S C C C T T C B S B C T T S C B C C C H H H H H H H T T C E E E E E E E E E T T S H H H H T T T C C B S C T T C H H H H H H H H H H H T C S E E E E E C G G G S S C G G G G G T S H H H H H H H H H T T T C S C C C C C C S S C C C H H H H H H H T T C E E E S S H H H H H H C C S S C E E E E C S S S S C C C H H H H H H H H H S C C C C S C C H H H H H H H H H H H H T T C T T C E E E E E E E C S H H H H H H T T C H H H H H H H H H H H H H H H H H H H H H H T T C S S E E E E E E E S C E E S C C E E C C B S S S C C C C B C C C S G G G S S S C B C C S S B C C C T H H H H H H H T C C S C H H H H H H H H H H S C G G G C C H H H H H H H H H H H C S S C C C H H H H H H H H C E E E C T T C C T T C T T T C C S E E E C C S S S G G G C C S C C T H H H H H H H H H H H H T E E C C C S S E E C C C E E E E E E S C H H H H G G G S S E E E H H H H H H H H H H T S C C C C C C C C C C C,1.0 1.0 1.0 1.0 1.0 1.0 1.0 1.0 1.0 1.0 1.0 1.0 1.0 1.0 1.0 1.0 1.0 1.0 1.0 1.0 1.0 1.0 1.0 1.0 1.0 1.0 1.0 1.0 1.0 1.0 1.0 1.0 1.0 1.0 1.0 1.0 1.0 1.0 1.0 1.0 1.0 1.0 1.0 1.0 1.0 1.0 1.0 1.0 1.0 1.0 1.0 1.0 1.0 1.0 1.0 1.0 1.0 1.0 1.0 1.0 1.0 1.0 1.0 1.0 1.0 1.0 1.0 1.0 1.0 1.0 1.0 1.0 1.0 1.0 1.0 1.0 1.0 1.0 1.0 1.0 1.0 1.0 1.0 1.0 1.0 1.0 1.0 1.0 1.0 1.0 1.0 1.0 1.0 1.0 1.0 1.0 1.0 1.0 1.0 1.0 1.0 1.0 1.0 1.0 1.0 1.0 1.0 1.0 1.0 1.0 1.0 1.0 1.0 1.0 1.0 1.0 1.0 1.0 1.0 1.0 1.0 1.0 1.0 1.0 1.0 1.0 1.0 1.0 1.0 1.0 1.0 1.0 1.0 1.0 1.0 1.0 1.0 1.0 1.0 1.0 1.0 1.0 1.0 1.0 1.0 1.0 1.0 1.0 1.0 1.0 1.0 1.0 1.0 1.0 1.0 1.0 1.0 1.0 1.0 1.0 1.0 1.0 1.0 1.0 1.0 1.0 1.0 1.0 1.0 1.0 1.0 1.0 1.0 1.0 1.0 1.0 1.0 1.0 1.0 1.0 1.0 1.0 1.0 1.0 1.0 1.0 1.0 1.0 1.0 1.0 1.0 1.0 1.0 1.0 1.0 1.0 1.0 1.0 1.0 1.0 1.0 1.0 1.0 1.0 1.0 1.0 1.0 1.0 1.0 1.0 1.0 1.0 1.0 1.0 1.0 1.0 1.0 1.0 1.0 1.0 1.0 1.0 1.0 1.0 1.0 1.0 1.0 1.0 1.0 1.0 1.0 1.0 1.0 1.0 1.0 1.0 1.0 1.0 1.0 1.0 1.0 1.0 1.0 1.0 1.0 1.0 1.0 1.0 1.0 1.0 1.0 1.0 1.0 1.0 1.0 1.0 1.0 1.0 1.0 1.0 1.0 1.0 1.0 1.0 1.0 1.0 1.0 1.0 1.0 1.0 1.0 1.0 1.0 1.0 1.0 1.0 1.0 1.0 1.0 1.0 1.0 1.0 1.0 1.0 1.0 1.0 1.0 1.0 1.0 1.0 1.0 1.0 1.0 1.0 1.0 1.0 1.0 1.0 1.0 1.0 1.0 1.0 1.0 1.0 1.0 1.0 1.0 1.0 1.0 1.0 1.0 1.0 1.0 1.0 1.0 1.0 1.0 1.0 1.0 1.0 1.0 1.0 1.0 1.0 1.0 1.0 1.0 1.0 1.0 1.0 1.0 1.0 1.0 1.0 1.0 1.0 1.0 1.0 1.0 1.0 1.0 1.0 1.0 1.0 1.0 1.0 1.0 1.0 1.0 1.0 1.0 1.0 1.0 1.0 1.0 1.0 1.0 1.0 1.0 1.0 1.0 1.0 1.0 1.0 1.0 1.0 1.0 1.0 1.0 1.0 1.0 1.0 1.0 1.0 1.0 1.0 1.0 1.0 1.0 1.0 1.0 1.0 1.0 1.0 1.0 1.0 1.0 1.0 1.0 1.0 1.0 1.0 1.0 1.0 1.0 1.0 1.0 1.0 1.0 1.0 1.0 1.0 1.0 1.0 1.0 1.0 1.0 1.0 1.0 1.0 1.0 1.0 1.0 1.0 1.0 1.0 1.0 1.0 1.0 1.0 1.0 1.0 1.0 1.0 1.0 1.0 1.0 1.0 1.0 1.0 1.0 1.0 1.0 1.0 1.0 1.0 1.0 1.0 1.0 1.0 1.0 1.0 1.0 1.0 1.0 1.0 1.0 1.0 1.0 1.0 1.0 1.0 1.0 1.0 1.0 1.0 1.0 1.0 1.0 1.0 1.0 1.0 1.0 1.0 1.0 1.0 1.0 1.0 1.0 1.0 1.0 1.0 1.0 1.0 1.0 1.0 1.0 1.0 1.0 1.0 1.0 1.0 1.0 1.0 1.0 1.0 1.0 1.0 1.0 1.0 1.0 1.0 1.0 1.0 1.0 1.0 1.0 1.0 1.0 1.0 1.0 1.0 1.0 0.0 0.0 0.0 0.0 0.0 0.0 0.0 0.0 0.0
M K H H H H H H P M A T D L G S F K A N F I D S D G N Q M T D V V E I N F A D A T E K N I S N L L N T L L G R D R E E F T P Y R F R I H I P G K D L I I D Q Y P N D L L S L L Q K H G V T N P F E T T I T L S A E P Q A,C C C C C C C C C C C C C C C E E E E E E E C C C C C E C C C C E E E E H H H C C H H H H H H H H H H H C C C C H H H C C C E E E E E E C C C C C C E E C C C C C C H H H H H H H C C C C C H H H C C E E E E E E E C C,C C C C C C C C C T T T C C C E E E E E E E C T T S C B C S C C E E E E G G G C C H H H H H H H H H H H T T C C G G G C C C E E E E E E C T T S S C E E C S C C S C H H H H H H H T T C S C G G G S C E E E E E E E C C,0.0 0.0 0.0 0.0 0.0 0.0 0.0 1.0 1.0 1.0 1.0 1.0 1.0 1.0 1.0 1.0 1.0 1.0 1.0 1.0 1.0 1.0 1.0 1.0 1.0 1.0 1.0 1.0 1.0 1.0 1.0 1.0 1.0 1.0 1.0 1.0 1.0 1.0 1.0 1.0 1.0 1.0 1.0 1.0 1.0 1.0 1.0 1.0 1.0 1.0 1.0 1.0 1.0 1.0 1.0 1.0 1.0 1.0 1.0 1.0 1.0 1.0 1.0 1.0 1.0 1.0 1.0 1.0 1.0 1.0 1.0 1.0 1.0 1.0 1.0 1.0 1.0 1.0 1.0 1.0 1.0 1.0 1.0 1.0 1.0 1.0 1.0 1.0 1.0 1.0 1.0 1.0 1.0 1.0 1.0 1.0 1.0 1.0 1.0 1.0 1.0 1.0 1.0 1.0 1.0 1.0 1.0 1.0
M H I S D E Q L K R P L R D Y G E A L E M W S T F Q T K T Q A L S Q S L S S Q L R L I L T G S G I P S K R A Y Q I L L C V D D S S S M S D D N R S T A G N L A L E S L V M V A R A L T V L E A G Q I G V M G F G T D V F V A H A L T D P P F T S Q D A G A R V L Q Q F T F R Q D S T D M V L L L R R T I D H F R E A R L I Q A S S S R G G E D L W Q L A L I L S D G L V Q S R D H A R L R P L L R E A M E Q R V M V V F I V M D D A R S R K G H S V L E L K E A R F G P D G V P V I H R Y L D S F P F P Y Y L I V H H L E D L P G A L A A L L R T W F A E V N S G S H H H H H H,C C C C C C C C C C C C C C H H H H H H H H H H H H H H H H H H H H H H H H H H H H H H C C C C C C C C C C E E E E E E E E C E H H H H C C C C C C H H H H H H H H H H H H H H H H H H H C C E E E E E E E E C C C E E E E E C C C C C C C C C H H H H H H H H C C C C C C E C C C C H H H H H H H H H H H H H H H H H H H H H C C C C C C C C E E E E E E E E C C C C C C H H H H H H H H H H H H H H H C C C E E E E E E E C C C C C C C C C C C C C C E E E E E C C C C C E E E E E H H H H C C C C C E E E E C C H H H H H H H H H H H H H H H H H H H C C C C C C C C C C,C C C C C C C C C C C C C C H H H H H H H H H H H H H H H H H H H H H H H H H H H H H H T T T T C C C C C C E E E E E E E E C B G G G G C T T T T C H H H H H H H H H H H H H H H H H H H C S E E E E E E E E S S S E E E E E C T T S C C T T S H H H H H H H H T T C C S C B S C C C H H H H H H H H H H H H H H H H H H H H H C C C C C C C C E E E E E E E E C C C C C T H H H H H H H H H H H H H H H T T C E E E E E E E C C T T S C T T C S T T T C E E E E E C T T C C E E E E E G G G G C C C S S E E E E S S G G G H H H H H H H H H H H H H H H H T C C C C C C C C C,0.0 0.0 0.0 0.0 0.0 0.0 0.0 1.0 1.0 1.0 1.0 1.0 1.0 1.0 1.0 1.0 1.0 1.0 1.0 1.0 1.0 1.0 1.0 1.0 1.0 1.0 1.0 1.0 1.0 1.0 1.0 1.0 1.0 1.0 1.0 1.0 1.0 1.0 1.0 1.0 1.0 1.0 1.0 1.0 1.0 1.0 1.0 1.0 1.0 0.0 0.0 1.0 1.0 1.0 1.0 1.0 1.0 1.0 1.0 1.0 1.0 1.0 1.0 1.0 1.0 1.0 1.0 1.0 1.0 1.0 1.0 1.0 1.0 1.0 1.0 1.0 1.0 1.0 1.0 1.0 1.0 1.0 1.0 1.0 1.0 1.0 1.0 1.0 1.0 1.0 1.0 1.0 1.0 1.0 1.0 1.0 1.0 1.0 1.0 1.0 1.0 1.0 1.0 1.0 1.0 1.0 1.0 1.0 1.0 1.0 1.0 1.0 1.0 1.0 1.0 1.0 1.0 1.0 1.0 1.0 1.0 1.0 1.0 1.0 1.0 1.0 1.0 1.0 1.0 1.0 1.0 1.0 1.0 1.0 1.0 1.0 1.0 1.0 1.0 1.0 1.0 1.0 1.0 1.0 1.0 1.0 1.0 1.0 1.0 1.0 1.0 1.0 1.0 1.0 1.0 1.0 1.0 1.0 1.0 1.0 1.0 0.0 0.0 0.0 0.0 0.0 1.0 1.0 1.0 1.0 1.0 1.0 1.0 1.0 1.0 1.0 1.0 1.0 1.0 1.0 1.0 1.0 1.0 1.0 1.0 1.0 1.0 1.0 1.0 1.0 1.0 1.0 1.0 1.0 1.0 1.0 1.0 1.0 1.0 1.0 1.0 1.0 1.0 1.0 1.0 1.0 1.0 1.0 1.0 1.0 1.0 1.0 1.0 1.0 1.0 1.0 1.0 1.0 1.0 1.0 1.0 1.0 1.0 1.0 1.0 1.0 1.0 1.0 1.0 1.0 1.0 1.0 1.0 1.0 1.0 1.0 1.0 1.0 1.0 1.0 1.0 1.0 1.0 1.0 1.0 1.0 1.0 1.0 1.0 1.0 1.0 1.0 1.0 1.0 1.0 1.0 1.0 1.0 1.0 1.0 1.0 1.0 1.0 1.0 1.0 1.0 1.0 1.0 1.0 1.0 1.0 1.0 0.0 0.0 0.0 0.0 0.0 0.0 0.0 0.0
M R G S H H H H H H G S G D L V A W N K K D D R R T L W T T P D T S P N C K M S T E K D S K L T L T L T K C G S Q V L G N V S L L A V T G E Y H Q M T A T T K K D V K I S L L F D E N G I L L P S S S L S K D Y W N Y R S D D S I V S Q K Y N N A V P F M P N L T A Y P K P S A Q N A K N Y S R T K I I S N V Y L G A L T Y Q P V I I T I A F N Q E T E N G C A Y S I T F T F T W Q K D Y S A Q Q F D V T S F T F S Y L T Q E N K D K D,C C C C C C C C C C C C C C C C C C C C C C C C C E E E C C C C C C C C E C C C C C C C E E E E E E E E E E C C E E E E E E E E E E C C C H H H C C C C C C C C E E E E E E E E C C C C C E C C C C C E C H H H C E E E E C C E E C C C C C C C C H H H C E C C C C C C C C C C C C C C C C H H H E E E E E E E E C C C C C C E E E E E E E E C C C C H H H C C E E E E E E E E C C C C C C C C C C E E C C E E E E E E E C C C C C C C,C C C C C C C C C C C C C C C C C C C C C C C C C E E E C C S S C C C C B C S S S T T C E E E E E E E E E E T T E E E E E E E E E E C S S G G G S C C T T S C S E E E E E E E E C T T S C B C T T S S B C G G G C E E E E T T E E C S C S C C C C G G G S B C T T T S C C C C T T T C C C C G G G E E E E E E E B T T C T T C E E E E E E E E S C C C G G G C S E E E E E E E E C C S C C T T S C C B B C C E E E E E E B S C C C C C C,0.0 0.0 0.0 0.0 0.0 0.0 0.0 0.0 0.0 0.0 0.0 0.0 0.0 0.0 0.0 0.0 0.0 0.0 0.0 0.0 0.0 0.0 0.0 1.0 1.0 1.0 1.0 1.0 1.0 1.0 1.0 1.0 1.0 1.0 1.0 1.0 1.0 1.0 1.0 1.0 1.0 1.0 1.0 1.0 1.0 1.0 1.0 1.0 1.0 1.0 1.0 1.0 1.0 1.0 1.0 1.0 1.0 1.0 1.0 1.0 1.0 1.0 1.0 1.0 1.0 1.0 1.0 1.0 1.0 1.0 1.0 1.0 1.0 1.0 1.0 1.0 1.0 1.0 1.0 1.0 1.0 1.0 1.0 1.0 1.0 1.0 1.0 1.0 1.0 1.0 1.0 1.0 1.0 1.0 1.0 1.0 1.0 1.0 1.0 1.0 1.0 1.0 1.0 1.0 1.0 1.0 1.0 1.0 1.0 1.0 1.0 1.0 1.0 1.0 1.0 1.0 1.0 1.0 1.0 1.0 1.0 1.0 1.0 1.0 1.0 1.0 1.0 1.0 1.0 1.0 1.0 1.0 1.0 1.0 1.0 1.0 1.0 1.0 1.0 1.0 1.0 1.0 1.0 1.0 1.0 1.0 1.0 1.0 1.0 1.0 1.0 1.0 1.0 1.0 1.0 1.0 1.0 1.0 1.0 1.0 1.0 1.0 1.0 1.0 1.0 1.0 1.0 1.0 1.0 1.0 1.0 1.0 1.0 1.0 1.0 1.0 1.0 1.0 1.0 1.0 1.0 1.0 1.0 1.0 1.0 1.0 1.0 1.0 1.0 1.0 1.0 1.0 1.0 1.0 1.0 1.0 1.0 1.0 1.0 1.0 1.0 1.0 1.0 1.0 1.0 1.0 1.0 1.0 0.0 0.0 0.0 0.0
M A F K L P N L P Y A Y D A L E P Y I D Q R T M E F H H D K H H N T Y V T K L N A T V E G T E L E H Q S L A D M I A N L D K V P E A M R M S V R N N G G G H F N H S L F W E I L S P N S E E K G G V I D D I K A Q W G T L D E F K N E F A N K A T T L F G S G W T W L V V N D G K L E I V T T P N Q D N P L T E G K T P I L G L D V W E H A Y Y L K Y Q N K R P D Y M T A F W N I V N W K K V D E L Y Q A A K,C C C C C C C C C C C C C C C C C C C C H H H H H H H H H C H H H H H H H H H H H H H C C C C C C C C C H H H H H H C H H H C C H H H H H H H H H H H H H H H H H H H H H H H E C C C C C C C C H H H H H H H H H H C C H H H H H H H H H H H H H H C C C C E E E E E E E E C C E E E E E E E E C C C C H H H H C C E E E E E E E C C H H H C H H H H C C C H H H H H H H H H H H E C H H H H H H H H H H H C,C C C C C C C C S S C T T T T T T T S C H H H H H H H H H T H H H H H H H H H H H H H T T S T T T T C C H H H H H H T G G G S C H H H H H H H H H H H H H H H H H H H H H H H B C T T C C C C S H H H H H H H H H H S S H H H H H H H H H H H H H H C C S S E E E E E E E E T T E E E E E E E E T T C C G G G G T C E E E E E E E C S G G G T H H H H T T C H H H H H H H H G G G B C H H H H H H H H H H H C,0.0 1.0 1.0 1.0 1.0 1.0 1.0 1.0 1.0 1.0 1.0 1.0 1.0 1.0 1.0 1.0 1.0 1.0 1.0 1.0 1.0 1.0 1.0 1.0 1.0 1.0 1.0 1.0 1.0 1.0 1.0 1.0 1.0 1.0 1.0 1.0 1.0 1.0 1.0 1.0 1.0 1.0 1.0 1.0 1.0 1.0 1.0 1.0 1.0 1.0 1.0 1.0 1.0 1.0 1.0 1.0 1.0 1.0 1.0 1.0 1.0 1.0 1.0 1.0 1.0 1.0 1.0 1.0 1.0 1.0 1.0 1.0 1.0 1.0 1.0 1.0 1.0 1.0 1.0 1.0 1.0 1.0 1.0 1.0 1.0 1.0 1.0 1.0 1.0 1.0 1.0 1.0 1.0 1.0 1.0 1.0 1.0 1.0 1.0 1.0 1.0 1.0 1.0 1.0 1.0 1.0 1.0 1.0 1.0 1.0 1.0 1.0 1.0 1.0 1.0 1.0 1.0 1.0 1.0 1.0 1.0 1.0 1.0 1.0 1.0 1.0 1.0 1.0 1.0 1.0 1.0 1.0 1.0 1.0 1.0 1.0 1.0 1.0 1.0 1.0 1.0 1.0 1.0 1.0 1.0 1.0 1.0 1.0 1.0 1.0 1.0 1.0 1.0 1.0 1.0 1.0 1.0 1.0 1.0 1.0 1.0 1.0 1.0 1.0 1.0 1.0 1.0 1.0 1.0 1.0 1.0 1.0 1.0 1.0 1.0 1.0 1.0 1.0 1.0 1.0 1.0 1.0 1.0 1.0 1.0 1.0 1.0 1.0 1.0 1.0 1.0 1.0 1.0 1.0 1.0 1.0 1.0 1.0 1.0
K T D I T S T K N E L V I T Y H G R L R S F S E E D T Y K I K A W L E D K I N S N L L I E M V I P Q A D I S F S D S L R L G Y E R G I I L M K E I K K I Y P D V V I D M S V N S A A S S T T S K A I I T T I N K,C C E E E E C C C E E E E E E C C C C C C C C H H H H H H H H H H H C C C C C E E E E E E E E E C C C C C C C C H H H H H H H H H H H H H H H H H H H H C C C C C E E E E E E E C C C C C C E E E E E E E E E C,C C E E E E C S S E E E E E E C S S C C C C C H H H H H H H H H H H T T C T T E E E E E E E E E C C C C C C C C H H H H H H H H H H H H H H H H H H H H C T T C C E E E E E E E C S S C C S E E E E E E E E E C,1.0 1.0 1.0 1.0 1.0 1.0 1.0 1.0 1.0 1.0 1.0 1.0 1.0 1.0 1.0 1.0 1.0 1.0 1.0 1.0 1.0 1.0 1.0 1.0 1.0 1.0 1.0 1.0 1.0 1.0 1.0 1.0 1.0 1.0 1.0 1.0 1.0 1.0 1.0 1.0 1.0 1.0 1.0 1.0 1.0 1.0 1.0 1.0 1.0 1.0 1.0 0.0 0.0 0.0 0.0 1.0 1.0 1.0 1.0 1.0 1.0 1.0 1.0 1.0 1.0 1.0 1.0 1.0 1.0 1.0 1.0 1.0 1.0 1.0 1.0 1.0 1.0 1.0 1.0 1.0 1.0 1.0 1.0 1.0 1.0 1.0 1.0 1.0 1.0 1.0 1.0 1.0 1.0 1.0 1.0 1.0 1.0 1.0 1.0 1.0 1.0 1.0 1.0 1.0
G M E R I L K K Q P A P V R A L T I H P L R R Y E S S I Y D T P I P A Y V I K H S S D G V T I D I A T S E L A D G Q S G S T I Q P F E S V P A Q N L T L F K H D F T F G H L A D T T D K K F V E V F G V L E N R A D D S D F Q S P D M I I E T E T G H V Y V V E F T T T M G D A N S A D L A A R N K I A K Y E I A C L D R S A I K P I S L Y I I A V H F N G V V S N L D L S D E E V N E I V F R F R L A R D I F E E L R E I N P A L F D,C C C C H H H H C C C C C C C E E C C C C E E E E C C C C C C C C C C E E E E E C C C E E E E E E C H H H C C C C C C C C C C C C E E E E E H H H H H H H H H H H H C C C C C C C C C C C H H H H H C C C C C C C C H H H H C C C C E E E E C C C C C E E E E E E E E C C C C H H H H H H H H H H H H H H H H H H H H H H C C C C C E E E E E E E E E C C E E E E C C C C C H H H H H H H H H H H H H H H H H H H H H C C C C C C C C C,C C C C G G G G S C C C C C C E E C C C C E E E E C C C C S C C C C C E E E E E C S S E E E E E E C G G G S C T T S T T T T C C S E E E E E G G G G G G H H H H H H T T T T C C C C C C C H H H H H C C S S S S C C G G G G C C C S E E E E C T T S C E E E E E E E E C S S C H H H H H H H H H H H H H H H H H H H H H H T T T S C E E E E E E E E E T T E E E E S S C C C H H H H H H H H H H H H H H H H H H H H H T C C C C C C C C,0.0 0.0 1.0 1.0 1.0 1.0 1.0 1.0 1.0 1.0 1.0 1.0 1.0 1.0 1.0 1.0 1.0 1.0 1.0 1.0 1.0 1.0 1.0 1.0 1.0 1.0 1.0 1.0 1.0 1.0 1.0 1.0 1.0 1.0 1.0 1.0 1.0 1.0 1.0 1.0 1.0 1.0 1.0 1.0 1.0 1.0 1.0 1.0 1.0 1.0 1.0 1.0 1.0 1.0 1.0 1.0 1.0 1.0 1.0 1.0 1.0 1.0 1.0 1.0 1.0 1.0 1.0 1.0 1.0 1.0 1.0 1.0 1.0 1.0 1.0 1.0 1.0 1.0 1.0 1.0 1.0 1.0 1.0 1.0 1.0 1.0 1.0 1.0 1.0 1.0 1.0 1.0 1.0 1.0 1.0 1.0 1.0 1.0 1.0 1.0 1.0 1.0 1.0 1.0 1.0 1.0 1.0 1.0 1.0 1.0 1.0 1.0 1.0 1.0 1.0 1.0 1.0 1.0 1.0 1.0 1.0 1.0 1.0 1.0 1.0 1.0 1.0 1.0 1.0 1.0 1.0 1.0 1.0 1.0 1.0 1.0 1.0 1.0 1.0 1.0 1.0 1.0 1.0 1.0 1.0 1.0 1.0 1.0 1.0 1.0 1.0 1.0 1.0 1.0 1.0 1.0 1.0 1.0 1.0 1.0 1.0 1.0 1.0 1.0 1.0 1.0 1.0 1.0 1.0 1.0 1.0 1.0 1.0 1.0 1.0 1.0 1.0 1.0 1.0 1.0 1.0 1.0 1.0 1.0 1.0 1.0 1.0 1.0 1.0 1.0 1.0 1.0 1.0 1.0 1.0 1.0 1.0 1.0 1.0 1.0 1.0 1.0 1.0 1.0 1.0 0.0 0.0 0.0 0.0 0.0 0.0 0.0
M S V R R T K I V A T L G P A S N S P E V L E Q L I L A G I D V A R L N F S H G T P D E H R A R A R L V R E L A A K H G R F V A L L G D L Q G P K I R I A K F A N K R I E L Q V G D K F R F S T S H A R D A G T Q E V V G I D Y P D L V K D C G V G D E L L L D D G R V V M V V E E V A A D E L R C R V L I G G P L S D H K G I N R R G G G L T A P A L T D K D K A D I K L A A D M D L D Y V A V S F P R D A K D M E Y A R R L L T E A G G K A W L V A K I E R A E A V A D D D A L D G L I R A S D A V M V A R G D L G V E I G D A E L V G I Q K K I I L H A R R N N K V V I T A T Q M M E S M I H S P M P T R A E V S D V A N A V L D Y T D A V M L S A E S A A G E Y P V E A V K A M A R V C Q G A E K H P T S Q K S S H R L G Q T F D R C D E S I A L A S M Y T A N H F P G I K A I I C L T E S G F T P L I M S R I R S S V P I Y A Y S P H R E T Q A R V A M F R G V E T I P F D P A A L P A E K V S Q A A V D E L L K R G V V T K G D W V I L T K G D S Y T A Q G G T N T M K V L H V G D L L V,C C C C C C E E E E E C C H H H C C H H H H H H H H H H C C C E E E E E C C C C C H H H H H H H H H H H H H H H H H C C C C C E E E E E C C C C C C E E C C E C C C E E E E C C C C E E E E E C C C C C C C E C C C E E E E C C H H H H H H C C C C C E E E E C C C C E E E E E E E E C C C E E E E E E E E C E E E E C C C E E E E C C C C C C C C C C C H H H H H H H H H H H H C C C C E E E E C C C C C H H H H H H H H H H H H H C C C C C E E E E E E C C H H H H C C H H H H H H H H H C C C E E E E E H H H H H H H H C H H H H H H H H H H H H H H H H H C C C E E E E E C C C C H H H H C C C C C C H H H H H H H H H H H H C C C C E E E E C H H H H C C C C H H H H H H H H H H H H H H H H C C H H H C C C C C C C C C C C C C H H H H H H H H H H H H H H H C C C E E E E E E E C C C C H H H H H H C C C C C C C C E E E E E C C H H H H H H H H H C C C E E E E E C C H H H C C H H H H H H H H H H H H H H C C C C C C C C E E E E E E C C C C C C C C C C C E E E E E E C C C C C C,C C C C C S E E E E E C S G G G C S H H H H H H H H H H T C C E E E E E T T S S C H H H H H H H H H H H H H H H H H T T C C C E E E E E C C C S C C B B C C B T T S E E E E C T T C E E E E E S S S C T T C B C S S E E E B S C H H H H H H C C T T C E E E E T T T T E E E E E E E E C S S E E E E E E E E C E E E E T T C B E E E T T C C C C C C S S C H H H H H H H H H H H H T T C S E E E E S S C C S H H H H H H H H H H H H H T T C C C E E E E E E C C G G G G S S H H H H H H H H H T C S E E E E E H H H H H H H H C G G G H H H H H H H H H H H H H H T T C E E E E E S S T T G G G G T C S S C C H H H H H H H H H H H H T T C S E E E E S H H H H T S S C H H H H H H H H H H H H H H H H T S G G G T C C C T T T T C C C C C H H H H H H H H H H H H H H H C T T E E E E E E E C S S S H H H H H H T T S C C C S C E E E E E S C H H H H H H G G G S T T E E E E E C C G G G S C G G G H H H H H H H H H H H T T S C C T T C E E E E E E C S C S S C S S C C C E E E E E E T T S C C C,1.0 1.0 1.0 1.0 1.0 1.0 1.0 1.0 1.0 1.0 1.0 1.0 1.0 1.0 1.0 1.0 1.0 1.0 1.0 1.0 1.0 1.0 1.0 1.0 1.0 1.0 1.0 1.0 1.0 1.0 1.0 1.0 1.0 1.0 1.0 1.0 1.0 1.0 1.0 1.0 1.0 1.0 1.0 1.0 1.0 1.0 1.0 1.0 1.0 1.0 1.0 1.0 1.0 1.0 1.0 1.0 1.0 1.0 1.0 1.0 1.0 1.0 1.0 1.0 1.0 1.0 1.0 1.0 1.0 1.0 1.0 1.0 1.0 1.0 1.0 1.0 1.0 1.0 1.0 1.0 1.0 1.0 1.0 1.0 1.0 1.0 1.0 1.0 1.0 1.0 1.0 1.0 1.0 1.0 1.0 1.0 1.0 1.0 1.0 1.0 1.0 1.0 1.0 1.0 1.0 1.0 1.0 1.0 1.0 1.0 1.0 1.0 1.0 1.0 1.0 1.0 1.0 1.0 1.0 1.0 1.0 1.0 1.0 1.0 1.0 1.0 1.0 1.0 1.0 1.0 1.0 1.0 1.0 1.0 1.0 1.0 1.0 1.0 1.0 1.0 1.0 1.0 1.0 1.0 1.0 1.0 1.0 1.0 1.0 1.0 1.0 1.0 1.0 1.0 1.0 1.0 1.0 1.0 1.0 1.0 1.0 1.0 1.0 1.0 1.0 1.0 1.0 1.0 1.0 1.0 1.0 1.0 1.0 1.0 1.0 1.0 1.0 1.0 1.0 1.0 1.0 1.0 1.0 1.0 1.0 1.0 1.0 1.0 1.0 1.0 1.0 1.0 1.0 1.0 1.0 1.0 1.0 1.0 1.0 1.0 1.0 1.0 1.0 1.0 1.0 1.0 1.0 1.0 1.0 1.0 1.0 1.0 1.0 1.0 1.0 1.0 1.0 1.0 1.0 1.0 1.0 1.0 1.0 1.0 1.0 1.0 1.0 1.0 1.0 1.0 1.0 1.0 1.0 1.0 1.0 1.0 1.0 1.0 1.0 1.0 1.0 1.0 1.0 1.0 1.0 1.0 1.0 1.0 1.0 1.0 1.0 1.0 1.0 1.0 1.0 1.0 1.0 1.0 1.0 1.0 1.0 1.0 1.0 1.0 1.0 1.0 1.0 1.0 1.0 1.0 1.0 1.0 1.0 1.0 1.0 1.0 1.0 1.0 1.0 1.0 1.0 1.0 1.0 1.0 1.0 1.0 1.0 1.0 1.0 1.0 1.0 1.0 1.0 1.0 1.0 1.0 1.0 1.0 1.0 1.0 1.0 1.0 1.0 1.0 1.0 1.0 1.0 1.0 1.0 1.0 1.0 1.0 1.0 1.0 1.0 1.0 1.0 1.0 1.0 1.0 1.0 1.0 1.0 1.0 1.0 1.0 1.0 1.0 1.0 1.0 1.0 1.0 1.0 1.0 1.0 1.0 1.0 1.0 1.0 1.0 1.0 1.0 1.0 1.0 1.0 1.0 1.0 1.0 1.0 1.0 1.0 1.0 1.0 1.0 1.0 1.0 1.0 1.0 1.0 1.0 1.0 1.0 1.0 1.0 1.0 1.0 1.0 1.0 1.0 1.0 1.0 1.0 1.0 1.0 1.0 1.0 1.0 1.0 1.0 1.0 1.0 1.0 1.0 1.0 1.0 1.0 1.0 1.0 1.0 1.0 1.0 1.0 1.0 1.0 1.0 1.0 1.0 1.0 1.0 1.0 1.0 1.0 1.0 1.0 1.0 1.0 1.0 1.0 1.0 1.0 1.0 1.0 1.0 1.0 1.0 1.0 1.0 1.0 1.0 1.0 1.0 1.0 1.0 1.0 1.0 1.0 1.0 1.0 1.0 1.0 1.0 1.0 1.0 1.0 1.0 1.0 1.0 1.0 1.0 1.0 1.0 1.0 1.0 1.0 1.0 1.0 1.0 1.0 1.0 1.0 1.0 1.0 1.0 1.0 1.0 1.0 1.0 1.0 1.0 1.0 1.0 1.0 1.0 1.0 1.0 1.0 1.0 1.0 1.0 1.0 1.0 1.0 1.0 1.0 1.0 1.0 1.0 1.0 1.0 1.0 1.0 1.0 1.0
M M V S F T A R A K S N V M A Y R L L A Y S Q G D D I I E I S H A A E N T I P D Y V A V K D V D K G D L T Q V N M Y P L A A W Q V I A G S D I K V G D N L T T G K D G T A V P T D D P S T V F G Y A V E E A Q E G Q L V T L V I S R S K L E H,C C E E E E E E E C C C E C C C C E E E E E E C C C C E E E E E C C C C C C C C E E C C C C E C C C C E E E E E E C C C C E E E E E E C C C E C C C C E E E E C H H H C E E E C C C H H H C C E E E C C C E C C C C E E E E E E C C C C C C C,C C E E E E E E E S S C B C T T C E E E E E E C S S S E E E E E C C T T S C C C E E C S S C B C T T C E E E E E E C C C S E E E E E B S S C B C T T C E E E E C G G G C E E E C C C G G G C C E E E S S C B C T T S E E E E E E C S S C C C C,1.0 1.0 1.0 1.0 1.0 1.0 1.0 1.0 1.0 1.0 1.0 1.0 1.0 1.0 1.0 1.0 1.0 1.0 1.0 1.0 1.0 1.0 1.0 1.0 1.0 1.0 1.0 1.0 1.0 1.0 1.0 1.0 1.0 1.0 1.0 1.0 1.0 1.0 1.0 1.0 1.0 1.0 1.0 1.0 1.0 1.0 1.0 1.0 1.0 1.0 1.0 1.0 1.0 1.0 1.0 1.0 1.0 1.0 1.0 1.0 1.0 1.0 1.0 1.0 1.0 1.0 1.0 1.0 1.0 1.0 1.0 1.0 1.0 1.0 1.0 1.0 1.0 1.0 1.0 1.0 1.0 1.0 1.0 1.0 1.0 1.0 1.0 1.0 1.0 1.0 1.0 1.0 1.0 1.0 1.0 1.0 1.0 1.0 1.0 1.0 1.0 1.0 1.0 1.0 1.0 1.0 1.0 1.0 1.0 1.0 1.0 1.0 1.0 1.0 1.0 1.0 1.0 1.0 0.0
S M D G S R R S G Y I T I G Y R G S Y T I G R D A Q A D A K F R R V A R I T V C G K T S L A K E V F G D T L N E S R D P D R P P E R Y T S R Y Y L K F N F L E Q A F D K L S E S G F H M V A C S S T G T C A F A S S T D Q S E D K I W T S Y T E Y V F C R E,C C C C C C C C E E E E E E E E E E C C C C C C C C C C C C C C C C C C E E E E E E H H H H H H H H H H H E E C C C C C C C C C C C E E E E E E E C C C C H H H H H H H H H H C C C E E E E E E E E E C C C C C C C C C C C C C C C C E E E E E E E E E E C,C C C C C T T C E E E E E E E E E E C C C C C C C C C C C C C C C C S C E E E E E E H H H H H H H H G G G E E C T T S C S C C T T S E E E E E E E S C C C H H H H H H H H H H T T C E E E E E E E E E C C C C C C C C C C C C C C C C E E E E E E E E E E C,0.0 0.0 0.0 0.0 1.0 1.0 1.0 1.0 1.0 1.0 1.0 1.0 1.0 1.0 1.0 1.0 1.0 1.0 1.0 0.0 0.0 0.0 0.0 0.0 0.0 0.0 0.0 0.0 0.0 0.0 0.0 1.0 1.0 1.0 1.0 1.0 1.0 1.0 1.0 1.0 1.0 1.0 1.0 1.0 1.0 1.0 1.0 1.0 1.0 1.0 1.0 1.0 1.0 1.0 1.0 1.0 1.0 1.0 1.0 1.0 1.0 1.0 1.0 1.0 1.0 1.0 1.0 1.0 1.0 1.0 1.0 1.0 1.0 1.0 1.0 1.0 1.0 1.0 1.0 1.0 1.0 1.0 1.0 1.0 1.0 1.0 1.0 1.0 1.0 1.0 1.0 1.0 1.0 1.0 1.0 1.0 1.0 1.0 1.0 1.0 0.0 0.0 0.0 0.0 0.0 0.0 0.0 0.0 0.0 0.0 0.0 0.0 1.0 1.0 1.0 1.0 1.0 1.0 1.0 1.0 1.0 1.0 1.0 1.0 1.0 1.0
