seq,dssp3,dssp8,disorder
M T I A I R Q L Q T H F V G Q V S G L D L R K P L T P G E A R E V E S A M D K Y A V L V F H D Q D I T D E Q Q M A F A L N F G Q R E D A R G G T V T K E K D Y R L Q S G L N D V S N L G K D G K P L A K D S R T H L F N L G N C L W H S D S S F R P I P A K F S L L S A R V V N P T G G N T E F A D M R A A Y D A L D D E T K A E I E D L V C E H S L M Y S R G S L G F T E Y T D E E K Q M F K P V L Q R L V R T H P V H R R K S L Y L S S H A G K I A S M S V P E G R L L L R D L N E H A T Q P E F V Y V H K W K L H D L V M W D N R Q T M H R V R R Y D Q S Q P R D M R R A T V A G T E P T V Q Q Q A A E,C C C C E E E C C C C C C E E E C C C C C C C C C C H H H H H H H H H H H H H H C E E E E C C C C C C H H H H H H H H H H H C C E C C C C C C C C C C C C C C C C C C C C E E C C C E C C C C C E C C C C C H H H H H H H H H H C C E C C C C C C C C C C C E E E E E E E E C C C C E C C E E E E E H H H H H H H C C H H H H H H H C C C E E E E C H H H H H H H C C C C C C C C C H H H H C C C E E E E C E E E C C C C C C E E E C C C C C E E E E C C C C H H H H H H H H H H H H H H H C C H H H E E E E C C C C C C E E E E E C C C E E E E E C C E C C C C C C E E E E E E E C C C C C C C C C C C C C,C C C C E E E C S S S C C E E E C S C C T T S C C C H H H H H H H H H H H H H H S E E E E C S C C C C H H H H H H H H G G G S C B C C C C C C C C C C C C C C C C C C C C E E C S S B C T T S S B C C T T S H H H H H H G G G G S C B C T T T T S S S C C C E E E E E E E E C C S S B C C E E E E E H H H H H H H S C H H H H H H H T T C E E E E C H H H H H H H T T C C C C C T T H H H H T C C E E E E S E E E C T T T C C E E E C C C T T E E E E T T S C H H H H H H H H H H H H H H H T S G G G E E E E C C C T T C E E E E E T T T E E E E E C C B C T T S C C E E E E E E B C C S S C C C C C C C C C,0.0 0.0 0.0 1.0 1.0 1.0 1.0 1.0 1.0 1.0 1.0 1.0 1.0 1.0 1.0 1.0 1.0 1.0 1.0 1.0 1.0 1.0 1.0 1.0 1.0 1.0 1.0 1.0 1.0 1.0 1.0 1.0 1.0 1.0 1.0 1.0 1.0 1.0 1.0 1.0 1.0 1.0 1.0 1.0 1.0 1.0 1.0 1.0 1.0 1.0 1.0 1.0 1.0 1.0 1.0 1.0 1.0 1.0 1.0 1.0 1.0 1.0 1.0 1.0 1.0 1.0 1.0 0.0 0.0 0.0 0.0 0.0 0.0 0.0 0.0 0.0 0.0 0.0 0.0 0.0 0.0 0.0 1.0 1.0 1.0 1.0 1.0 1.0 1.0 1.0 1.0 1.0 1.0 1.0 1.0 1.0 1.0 1.0 1.0 1.0 1.0 1.0 1.0 1.0 1.0 1.0 1.0 1.0 1.0 1.0 1.0 1.0 1.0 1.0 1.0 1.0 1.0 1.0 1.0 1.0 1.0 1.0 1.0 1.0 1.0 1.0 1.0 1.0 1.0 1.0 1.0 1.0 1.0 1.0 1.0 1.0 1.0 1.0 1.0 1.0 1.0 1.0 1.0 1.0 1.0 1.0 1.0 1.0 1.0 1.0 1.0 1.0 1.0 1.0 1.0 1.0 1.0 1.0 1.0 1.0 1.0 1.0 1.0 1.0 1.0 1.0 1.0 1.0 1.0 1.0 1.0 1.0 1.0 1.0 1.0 1.0 1.0 1.0 1.0 1.0 1.0 1.0 1.0 1.0 1.0 1.0 1.0 1.0 1.0 1.0 1.0 1.0 1.0 1.0 1.0 1.0 1.0 1.0 1.0 1.0 1.0 1.0 1.0 1.0 1.0 1.0 1.0 1.0 1.0 1.0 1.0 1.0 1.0 1.0 1.0 1.0 1.0 1.0 1.0 1.0 1.0 1.0 1.0 1.0 1.0 1.0 1.0 1.0 1.0 1.0 1.0 1.0 1.0 1.0 1.0 1.0 1.0 1.0 1.0 1.0 1.0 1.0 1.0 1.0 1.0 1.0 1.0 1.0 1.0 1.0 1.0 1.0 1.0 1.0 1.0 1.0 1.0 1.0 1.0 1.0 1.0 1.0 1.0 1.0 1.0 1.0 1.0 1.0 1.0 1.0 1.0 1.0 1.0 1.0 1.0 1.0 1.0 1.0 1.0 1.0 1.0 1.0 1.0 1.0 1.0 1.0 1.0 1.0 1.0 0.0 0.0 0.0 0.0 0.0 0.0
S M S P N G N L I R M L V L F F L E S E L H E H A A Y L V D S L W E S S Q E L L K D W E C M T E L L L E E P V Q G E E A M S D R Q E S A L I E L M V C T I R Q A A E A H P P V G R G T G K R V L T A K E R K T Q I D D R N K L T E H F I I T L P M L L S K Y S A D A E K V A N L L Q I P Q Y F D L E I Y S T G R M E K H L D A L L K Q I K F V V E K H V E S D V L E A C S K T Y S I L C S E E Y T I Q N R V D I A R S Q L I D E F V D R F N H S V E D L L Q E G E E A D D D D I Y N V L S T L K R L T S F H N A H D L T K W D L F G N C Y R L L K T G I E H G A M P E Q I V V Q A L Q C S H Y S I L W Q L V K I T D G S P S K E D L L V L R K T V K S F L A V C Q Q C L S N V N T P V K E Q A F M L L C D L L M I F S H Q L M T G G R E G L Q P L V F N P D T G L Q S E L L S F V M D H V F I D Q D E E N Q S M E G D E E D E A N K I E A L H K R R N L L A A F S K L I I Y D I V D M H A A A D I F K H Y M K Y Y N D Y G D I I K E T L S K T R Q I D,C C C C C H H H H H H H H H H H H H C C C H H H H H H H H H H H H H H H H H H H C C H H H H H H H H H C C C C C C C C C C C H H H H H H H H H H H H H H H H H H H H C C C C C C C C C C C C C C C C C H H H H H H H H H H H H H H H H H H H H H H H H H H H C C C H H H H H H H C C C H H H C C H H H H C C C C C H H H H H H H H H H H H H H H H H C C C H H H H H H H H H H H H H H C C C C C C C H H H H H H H H H H H H H H H H H H H H H H H H H H C C C C C C C C H H H H H H H H H H H H H H H H H H H H C C C C C C C H H H H H H H H H H H H H C C C C C C H H H H H H H H H H H H H H H H H H H H H H H C C C C C H H H H H H H H H H H H H H H H H H H H H C C C C C H H H H H H H H H H H H H H H H H C C H H H C C C C C H H H H H H C C C C C H H H H H H H H H H H H H H H C C C C C C C C C C C C C C C C C C C C H H H H H H H H H H H H H H H H H H H H C C C C C C C H H H H H H H H C C C C C C C C H H H H H H H H H H C C C C C,C C C C C H H H H H H H H H H H H H T T C G G G H H H H H H H H H H H H H H H H T C H H H H H H H H H C C C C C C C C C C C H H H H H H H H H H H H H H H H H H H H C S C C T T T C C C C C C C C S S H H H H H H H H H H H H H H H H H H H H H H H H H H H T T C H H H H H H H T T S G G G S C G G G G T T T T C H H H H H H H H H H H H H H H H H C C C H H H H H H H H H H H H H H C C S S S T T H H H H H H H H H H H H H H H H H H H H H H H H H H T T C C C C C C H H H H H H H H H H H H H H H H H H H H S C C T T S C H H H H H H H H H H H H H T T S C S C H H H H H H H H H H H H H H H H H H H H H H H T S C C C H H H H H H H H H H H H H H H H H H H H H T T C S S H H H H H H H H H H H H H H H H H S S G G G T T T T C G G G G G G C C C C C H H H H H H H H H H H H H H H S C C C C C C C C C C C C C C C C T T S H H H H H H H H H H H H H H H H H H H H T T S S C T T G G G G G G G G S S T T T T T T H H H H H H H H H H C C C C C,0.0 0.0 0.0 1.0 1.0 1.0 1.0 1.0 1.0 1.0 1.0 1.0 1.0 1.0 1.0 1.0 1.0 1.0 1.0 1.0 1.0 1.0 1.0 1.0 1.0 1.0 1.0 1.0 1.0 1.0 1.0 1.0 1.0 1.0 1.0 1.0 1.0 1.0 1.0 1.0 1.0 1.0 1.0 1.0 1.0 1.0 1.0 1.0 1.0 1.0 1.0 1.0 1.0 0.0 0.0 0.0 0.0 0.0 0.0 1.0 1.0 1.0 1.0 1.0 1.0 1.0 1.0 1.0 1.0 1.0 1.0 1.0 1.0 1.0 1.0 1.0 1.0 1.0 1.0 1.0 1.0 1.0 1.0 1.0 1.0 1.0 1.0 1.0 1.0 1.0 0.0 0.0 0.0 0.0 1.0 1.0 1.0 1.0 1.0 1.0 1.0 1.0 1.0 1.0 1.0 1.0 1.0 1.0 1.0 1.0 1.0 1.0 1.0 1.0 1.0 1.0 1.0 1.0 1.0 1.0 1.0 1.0 1.0 1.0 1.0 1.0 1.0 1.0 1.0 1.0 1.0 1.0 1.0 1.0 1.0 1.0 1.0 1.0 1.0 1.0 1.0 1.0 1.0 1.0 1.0 1.0 1.0 1.0 1.0 1.0 1.0 1.0 1.0 1.0 1.0 1.0 1.0 1.0 1.0 1.0 1.0 1.0 1.0 1.0 1.0 1.0 1.0 1.0 1.0 1.0 1.0 1.0 1.0 1.0 1.0 1.0 1.0 1.0 1.0 1.0 1.0 1.0 1.0 1.0 1.0 1.0 1.0 1.0 1.0 1.0 1.0 1.0 1.0 1.0 1.0 1.0 1.0 1.0 1.0 1.0 1.0 1.0 1.0 1.0 1.0 1.0 1.0 1.0 1.0 1.0 1.0 1.0 1.0 1.0 1.0 1.0 1.0 1.0 1.0 1.0 1.0 1.0 1.0 0.0 0.0 0.0 0.0 1.0 1.0 1.0 1.0 1.0 1.0 1.0 1.0 1.0 1.0 1.0 1.0 1.0 1.0 1.0 1.0 1.0 1.0 1.0 1.0 1.0 1.0 1.0 1.0 1.0 1.0 1.0 1.0 1.0 1.0 1.0 1.0 1.0 1.0 1.0 1.0 1.0 1.0 1.0 1.0 1.0 1.0 1.0 1.0 1.0 1.0 1.0 1.0 1.0 1.0 1.0 1.0 1.0 1.0 1.0 1.0 1.0 1.0 1.0 1.0 1.0 1.0 1.0 1.0 1.0 1.0 1.0 1.0 1.0 1.0 1.0 1.0 1.0 1.0 1.0 1.0 1.0 1.0 1.0 1.0 1.0 1.0 1.0 1.0 1.0 1.0 1.0 1.0 1.0 1.0 1.0 1.0 1.0 1.0 1.0 1.0 1.0 1.0 1.0 1.0 1.0 1.0 1.0 1.0 1.0 1.0 1.0 1.0 1.0 1.0 1.0 1.0 1.0 1.0 1.0 1.0 1.0 1.0 1.0 1.0 1.0 1.0 1.0 1.0 1.0 1.0 1.0 1.0 1.0 1.0 1.0 1.0 1.0 1.0 1.0 1.0 1.0 1.0 1.0 1.0 1.0 1.0 1.0 1.0 1.0 1.0 1.0 1.0 1.0 1.0 1.0 1.0 1.0 1.0 1.0 1.0 1.0 0.0 0.0 0.0 0.0 0.0 0.0 0.0 0.0 0.0 0.0 0.0 0.0 0.0 1.0 1.0 1.0 1.0 1.0 1.0 1.0 1.0 1.0 1.0 1.0 1.0 1.0 1.0 1.0 1.0 1.0 1.0 1.0 1.0 1.0 1.0 1.0 1.0 1.0 1.0 1.0 1.0 1.0 1.0 1.0 1.0 1.0 1.0 1.0 1.0 1.0 1.0 1.0 1.0 1.0 1.0 1.0 1.0 1.0 1.0 1.0 1.0 1.0 1.0 1.0 1.0 1.0 1.0 1.0 1.0 1.0 1.0 0.0 0.0 0.0 0.0
S M G G T L F E V V K L G K S A M Q S V V D D W I E S Y K Q D R D I A L L D L I N F F I Q C S G C R G T V R I E M F R N M Q N A E I I R K M T E E F D E D S G D Y P L T M P G P Q W K K F R S N F C E F I G V L I R Q C Q Y S I I Y D E Y M M D T V I S L L T G L S D S Q V R A F R H T S T L A A M K L M T A L V N V A L N L S I H Q D N T Q R Q Y E A E R N K M I G K R A N E R L E L L L Q K R K E L Q E N Q D E I E N M M N S I F K G I F V H R Y R D A I A E I R A I C I E E I G V W M K M Y S D A F L N D S Y L K Y V G W T L H D R Q G E V R L K C L K A L Q S L Y T N R E L F P K L E L F T N R F K D R I V S M T L D K E Y D V A V E A I R L V T L I L H G S E E A L S N E D C E N V Y H L V,C C C C C H H H H H H H C C C H H H H H H H H H H H H H H H C H H H H H H H H H H H H H H H C C C C C C C C C H H H H C C C H H H H H H H H H H C C C C C C C C C H H H C C C H H H C C H H H H H H H H H H H H H H H H C C C H H H C C C H H H H H H H H H H H H C C C C C H H H H H H H H H H H H H H H H H H H H H H H H H H H H H H H H H C C C C C C C C C C C C C C C C C C C C H H H H H H H H H H H H H H H H H H H H H H H H H H C H H H H C C C C C H H H H H H H H H H H H H H H H H C H H H H C C H H H H H H H H H H H C C C C H H H H H H H H H H H H H H H C C C C C H H H H H H H H H H H H H H H H H H H H C C C H H H H H H H H H H H H H H H C C C C C C C C C C C C C C C C C C C,C C C C C H H H H H H H C C C H H H H H H H H H H H H H H H C H H H H H H H H H H H H H H H T T C C C C C C S H H H H T C C H H H H H H H H H H T C C C C C C C C G G G C C S G G G T T H H H H H H H H H H H H H H H H T T T G G G S T T H H H H H H H H H H H H T T C S C H H H H H H H H H H H H H H H H H H H H H H H H H H H H H H H H H T T T C C C C C C C C C C C C C C C C C H H H H H H H H H H H H H H H H H H H H H H H H H H T H H H H T T C S S H H H H H H H H H H H H H H H H H T H H H H C S H H H H H H H H H H H T C S C H H H H H H H H H H H H H H H T S T T S H H H H H H H H H H H H H H H H H G G G C S S H H H H H H H H H H H H H H H C C C C C C C C C C C C C C C C C C C,0.0 0.0 0.0 1.0 1.0 1.0 1.0 1.0 1.0 1.0 1.0 1.0 1.0 1.0 1.0 1.0 1.0 1.0 1.0 1.0 1.0 1.0 1.0 1.0 1.0 1.0 1.0 1.0 1.0 1.0 1.0 1.0 1.0 1.0 1.0 1.0 1.0 1.0 1.0 1.0 1.0 1.0 1.0 1.0 1.0 1.0 1.0 1.0 1.0 1.0 1.0 1.0 1.0 1.0 1.0 1.0 1.0 1.0 1.0 1.0 1.0 1.0 1.0 1.0 1.0 1.0 1.0 1.0 1.0 1.0 1.0 1.0 1.0 1.0 0.0 0.0 0.0 0.0 0.0 0.0 1.0 1.0 1.0 1.0 1.0 1.0 1.0 1.0 1.0 1.0 1.0 1.0 1.0 1.0 1.0 1.0 1.0 1.0 1.0 1.0 1.0 1.0 1.0 1.0 1.0 1.0 1.0 1.0 1.0 1.0 1.0 1.0 1.0 1.0 1.0 1.0 1.0 1.0 1.0 1.0 1.0 1.0 1.0 1.0 1.0 1.0 1.0 1.0 1.0 1.0 1.0 1.0 1.0 1.0 1.0 1.0 1.0 1.0 1.0 1.0 1.0 1.0 1.0 1.0 1.0 1.0 1.0 1.0 1.0 1.0 1.0 1.0 1.0 1.0 1.0 1.0 1.0 1.0 1.0 1.0 1.0 1.0 1.0 1.0 1.0 1.0 1.0 1.0 1.0 1.0 1.0 0.0 0.0 0.0 0.0 0.0 0.0 0.0 0.0 0.0 0.0 0.0 0.0 0.0 0.0 0.0 1.0 1.0 1.0 1.0 1.0 1.0 1.0 1.0 1.0 1.0 1.0 1.0 1.0 1.0 1.0 1.0 1.0 1.0 1.0 1.0 1.0 1.0 1.0 1.0 1.0 1.0 1.0 1.0 1.0 1.0 1.0 1.0 1.0 1.0 1.0 1.0 1.0 1.0 1.0 1.0 1.0 1.0 1.0 1.0 1.0 1.0 1.0 1.0 1.0 1.0 1.0 1.0 1.0 1.0 1.0 1.0 1.0 1.0 1.0 1.0 1.0 1.0 1.0 1.0 1.0 1.0 1.0 1.0 1.0 1.0 1.0 1.0 1.0 1.0 1.0 1.0 1.0 1.0 1.0 1.0 1.0 1.0 1.0 1.0 1.0 1.0 1.0 1.0 1.0 1.0 1.0 1.0 1.0 1.0 1.0 1.0 1.0 1.0 1.0 1.0 1.0 1.0 1.0 1.0 1.0 1.0 1.0 1.0 1.0 1.0 1.0 1.0 1.0 1.0 1.0 1.0 1.0 1.0 1.0 1.0 1.0 1.0 1.0 1.0 1.0 1.0 1.0 1.0 1.0 1.0 1.0 1.0 1.0 1.0 1.0 1.0 0.0 0.0 0.0 0.0 0.0 0.0 0.0 0.0 0.0 0.0 0.0 0.0 0.0 0.0 0.0 0.0 0.0
M G F W G L E V K P G K P Q A Y N P K N E Q G K I H V T Q A T L G T G L S K E K S V I Q C S I G D K A P I A L C S L L P N K I E C C P L N L E F D D D D E P V E F T V T G D R S I H L S G F L E Y Y Q D L E H H H H H H,C C C E E E E E C C C C C E E C C C C C C C C C E E E E E E E E C C C C C C C C E E E E E E E C C C C C E E E E E E E C C C E C E E E E E E E E C C C C C C E E E E E E C C C C E E E E E E E C C C C C C C C C C C C C,C C C E E E E E C S S S C E E C C C C C C C C C E E E E E E E E C S C S C C S C E E E E E E E T T S C C E E E E E E B T T T B S E E E E E E E E C T T C C C E E E E E E S S S C E E E E E E E C C C C C C C C C C C C C,0.0 0.0 1.0 1.0 1.0 1.0 1.0 1.0 1.0 1.0 1.0 1.0 1.0 1.0 1.0 1.0 1.0 0.0 0.0 0.0 0.0 0.0 0.0 1.0 1.0 1.0 1.0 1.0 1.0 1.0 1.0 1.0 1.0 1.0 1.0 1.0 1.0 1.0 1.0 1.0 1.0 1.0 1.0 1.0 1.0 1.0 1.0 1.0 1.0 1.0 1.0 1.0 1.0 1.0 1.0 1.0 1.0 1.0 1.0 1.0 1.0 1.0 1.0 1.0 1.0 1.0 1.0 1.0 1.0 1.0 1.0 1.0 1.0 1.0 1.0 1.0 1.0 1.0 1.0 1.0 1.0 1.0 1.0 1.0 1.0 1.0 1.0 1.0 1.0 1.0 1.0 1.0 1.0 1.0 1.0 1.0 0.0 0.0 0.0 0.0 0.0 0.0 0.0 0.0 0.0 0.0 0.0 0.0
M D P P A R K E K T K V K E S V S R V E K A K Q K S A Q Q E L K Q R Q R A E I Y A L N R V M T E L E Q Q Q F D E F C K Q M Q P P G E,C C C C C C C C C C C C C C C C C C C C C C C C C C H H H H H H H H H H H H H H H H H H H H H H H H H H H H H H H H C C C C C C C C,C C C C C C C C C C C C C C C C C C C C C C C C T T H H H H H H H H H H H H H H H H H H H H H H H H H H H H H H H H C C C C C C C C,0.0 0.0 0.0 0.0 0.0 0.0 0.0 0.0 0.0 0.0 0.0 0.0 0.0 0.0 0.0 0.0 0.0 0.0 0.0 0.0 0.0 0.0 0.0 1.0 1.0 1.0 1.0 1.0 1.0 1.0 1.0 1.0 1.0 1.0 1.0 1.0 1.0 1.0 1.0 1.0 1.0 1.0 1.0 1.0 1.0 1.0 1.0 1.0 1.0 1.0 1.0 1.0 1.0 1.0 1.0 1.0 1.0 1.0 1.0 0.0 0.0 0.0 0.0 0.0 0.0 0.0
G L T Y T M C D K T K F T W K R A P T D S G H D T V V M E V T F S G T K P C R I P V R A V A H G S P D V N V A M L I T P N P T I E N N G G G F I E M Q L P P G D N I I Y V G E L S H Q W F Q K G S S I G R,C C C C C E C C C C C E E E E E E E E E C C C C C E E E E E E E C C C C C E E C C E E E E E C C E C C C C C C E E C C C C C E E E C C E E C E E E E E C C C E E E E E E E C C E E E E E E E C C C C C C C,C C C C C B C C T T C E E E E E E E E E C S S S C E E E E E E E C S S S S E E C C E E E E E T T B T T S C C C E E C S S S C E E E T T E E C E E E E E C C S E E E E E E E T T E E E E E E E C C C C C C C,0.0 0.0 0.0 1.0 1.0 1.0 1.0 1.0 1.0 1.0 1.0 1.0 1.0 1.0 1.0 1.0 1.0 1.0 1.0 1.0 1.0 1.0 1.0 1.0 1.0 1.0 1.0 1.0 1.0 1.0 1.0 1.0 1.0 1.0 1.0 1.0 1.0 1.0 1.0 1.0 1.0 1.0 1.0 1.0 1.0 1.0 1.0 1.0 1.0 1.0 1.0 1.0 1.0 1.0 1.0 1.0 1.0 1.0 1.0 1.0 1.0 1.0 1.0 1.0 1.0 1.0 1.0 1.0 1.0 1.0 1.0 1.0 1.0 1.0 1.0 1.0 1.0 1.0 1.0 1.0 1.0 1.0 1.0 1.0 1.0 1.0 1.0 1.0 1.0 1.0 1.0 1.0 1.0 1.0 1.0 1.0 1.0 0.0 0.0 0.0 0.0
M G V I V E L I D H T S A I A A A K D R A D L V E R L R A A K A R I S D P Q I R V V I A G Q L K Q G K S Q L L N S L L N I P V A R V G D D E S T V L A T V V S Y G E Q A S A R L V V A R P D G A E P E L I E I P P S E V T T D L R R A P Q A S G R Q V L R V E V T A P S P L L K G G L A F V D T P G V G G H G Q P H L S A T L G L L P D A D A M L M I S D T S Q E F T E P E M K F I R Q A L E I C P V A A I V A T K T D L Y P H W R Q I V D A N I A H L Q R A G L N V P V I P A S S V L R S H A I S L N D K E L N E E S N F P A I V K F L S E H V L S R Q N D R I R D Q I V D E I R S A A E H L L L A V E S E L S S F N D P G E R E R L T A E L E R R K Q E A Q D A L Q Q T A L W Q Q V L S D G I A D L T A D V D H D L R H R F R I I A A H T E K V I D G C D P T L H W A E I G A E L E D A V A T A V G D N F V W A Y Q R A E A L A A E V A R T F T E A G L D A V Q M P Q I D A R D M G A G F G E L N S L A R L E A K P I K I G H K V V T G M R G S Y G G V L M F G M L T S F A G L G M F N P L S L G A G F V L G R K A Y K E D M E N R M L R V R N E A K A N V R K F V D D V A F V V G K E S R D R L K G I Q R Q L R D H Y R E I A N Q T T R S L N E S L Q A A I A A A K V E E A E R N T R V K E L E R Q Q N I L K Q V V D H A A K L A A A L E H H H H H H,C C H H H H H H H H H H H H H H H C C C H H H H H H H H H H H H H H H C C C E E E E E E C C C C C C H H H H H H H H H C C C C C C C C C C C C C C C C E E E E E C C C C C E E E E E C C H H H C C C E E E E C C H H H H C C C H H H C H H H C C C C E E E E E E E E C C H H H C C C E E E E E C C C C C C E C C C C H H H H H H H C C C C C E E E E E E E C C C C C C H H H H H H H H H H H H H C C C E E E E E E C C C C C C C H H H H H H H H H H H H H H C C C C C C E E E C C H H H H H H H H H H C C H H H H H H C C H H H H H H H H H H H C H H H H H H H H H H H H H H H H H H H H H H H H H H H H H H H H H H H C H H H H H H H H H H H H H H H H H H H H C C C C C C H H H H H H H H H H H H H H H H H H H H H H H H H H H H H H H H H H H H H C C C H H H C H H H H H H H H H H H H H H H H H H H H H H H H H H H H H H H H H H H H H H H H C C C C C C C C C C C C C C C C C C C C C C C C C C C C C C C C C C C C C C C C C C C C C C C C C C C C C C C C C C C C C C E C C C C C C C C C C C C C C C C C C C C C C H H H H H H H H H H H H H H H H H H H H H H H H H H H H H H H H H H H H H H H H H H H H H H H H H H H H H H H H H H H H H H H H H H H H H C C H H H H H H H H H H H H H H H H H H H H H H H H H H H C C C C C C C C C C C C,C C H H H H H H H H H H H H H H H T T C H H H H H H H H H H H H H H H S C C E E E E E E C S T T S S H H H H H H H H H T S C C S C C C T T C C C C S C E E E E E C S S C C E E E E E C C G G G C C C E E E E C C G G G G T S C G G G C G G G T T C C E E E E E E E E C C G G G T T S E E E E E C C C C S S B T S C C G G G G G G G S T T C S E E E E E E E T T S C C C H H H H H H H H H H H H H C C C E E E E E E C T T T C T T H H H H H H H H H H H H H H T T C C C C E E E C C H H H H H H H H H H T C H H H H H H T T H H H H H H H H H H H T H H H H H H H H H H H H H H H H H H H H H H H H H H H H H H H H H H H C G G G H H H H H H H H H H H H H H H H H T T S T T C H H H H H H H H H H H H H H H H H H H H H H H H H H H H H H H H H H H H H T S C G G G S H H H H H H H H H H H H H H H H H H H H H H H H H H H H H H H H H H H H H H H H T T T T C C C C C C C C C C C C C C C C C C C C C C C C C C C C C C C C C C C C C C C C C C C C C S C C C C C C C C C S S C B T C C C S S C T T C C S S T T C C S S C C C H H H H H H H H H H H H H H H H H H H H H H H H H H H H H H H H H H H H H H H H H H H H H H H H H H H H H H H H H H H H H H H H H H G G G S C G G G H H H H H H H H H H H H H H H H H H H H H H H H T C C C C C C C C C C C,1.0 1.0 1.0 1.0 1.0 1.0 1.0 1.0 1.0 1.0 1.0 1.0 1.0 1.0 1.0 1.0 1.0 1.0 1.0 1.0 1.0 1.0 1.0 1.0 1.0 1.0 1.0 1.0 1.0 1.0 1.0 1.0 1.0 1.0 1.0 1.0 1.0 1.0 1.0 1.0 1.0 1.0 1.0 1.0 1.0 1.0 1.0 1.0 1.0 1.0 1.0 1.0 1.0 1.0 1.0 1.0 1.0 1.0 1.0 1.0 1.0 1.0 1.0 1.0 1.0 1.0 1.0 1.0 1.0 1.0 1.0 1.0 1.0 1.0 1.0 1.0 1.0 1.0 1.0 1.0 1.0 1.0 1.0 1.0 1.0 1.0 1.0 1.0 1.0 1.0 1.0 1.0 1.0 1.0 1.0 1.0 1.0 1.0 1.0 1.0 1.0 1.0 1.0 1.0 1.0 1.0 1.0 1.0 1.0 1.0 1.0 1.0 1.0 1.0 1.0 1.0 1.0 1.0 1.0 1.0 1.0 1.0 1.0 1.0 1.0 1.0 1.0 1.0 1.0 1.0 1.0 1.0 1.0 1.0 1.0 1.0 1.0 1.0 1.0 1.0 1.0 1.0 1.0 1.0 1.0 1.0 1.0 1.0 1.0 1.0 1.0 1.0 1.0 1.0 1.0 1.0 1.0 1.0 1.0 1.0 1.0 1.0 1.0 1.0 1.0 1.0 1.0 1.0 1.0 1.0 1.0 1.0 1.0 1.0 1.0 1.0 1.0 1.0 1.0 1.0 1.0 1.0 1.0 1.0 1.0 1.0 1.0 1.0 1.0 1.0 1.0 1.0 1.0 1.0 1.0 1.0 1.0 1.0 1.0 1.0 1.0 1.0 1.0 1.0 1.0 1.0 1.0 1.0 1.0 1.0 1.0 1.0 1.0 1.0 1.0 1.0 1.0 1.0 1.0 1.0 1.0 1.0 1.0 1.0 1.0 1.0 1.0 1.0 1.0 1.0 1.0 1.0 1.0 1.0 1.0 1.0 1.0 1.0 1.0 1.0 1.0 1.0 1.0 1.0 1.0 1.0 1.0 1.0 1.0 1.0 1.0 1.0 1.0 1.0 1.0 1.0 1.0 1.0 1.0 1.0 1.0 1.0 1.0 1.0 1.0 1.0 1.0 1.0 1.0 1.0 1.0 1.0 1.0 1.0 1.0 1.0 1.0 1.0 1.0 1.0 1.0 1.0 1.0 1.0 1.0 1.0 1.0 1.0 1.0 1.0 1.0 1.0 1.0 1.0 1.0 1.0 1.0 1.0 1.0 1.0 1.0 1.0 1.0 1.0 1.0 1.0 1.0 1.0 1.0 1.0 1.0 1.0 1.0 1.0 1.0 1.0 1.0 1.0 1.0 1.0 1.0 1.0 1.0 1.0 1.0 1.0 1.0 1.0 1.0 1.0 1.0 1.0 1.0 1.0 1.0 1.0 1.0 1.0 1.0 1.0 1.0 1.0 1.0 1.0 1.0 1.0 1.0 1.0 1.0 1.0 1.0 1.0 1.0 1.0 1.0 1.0 1.0 1.0 1.0 1.0 1.0 1.0 1.0 1.0 1.0 1.0 1.0 1.0 1.0 1.0 1.0 1.0 1.0 1.0 1.0 1.0 1.0 1.0 1.0 1.0 1.0 1.0 1.0 1.0 1.0 1.0 1.0 1.0 1.0 1.0 1.0 1.0 1.0 1.0 1.0 1.0 1.0 1.0 1.0 1.0 1.0 1.0 1.0 1.0 1.0 1.0 1.0 1.0 1.0 1.0 1.0 1.0 1.0 1.0 1.0 1.0 1.0 1.0 1.0 1.0 1.0 1.0 1.0 0.0 0.0 0.0 0.0 0.0 0.0 0.0 0.0 0.0 0.0 0.0 0.0 0.0 0.0 0.0 0.0 0.0 0.0 0.0 0.0 0.0 0.0 0.0 0.0 0.0 0.0 0.0 0.0 0.0 0.0 0.0 0.0 0.0 0.0 0.0 1.0 1.0 1.0 1.0 1.0 1.0 1.0 1.0 1.0 1.0 1.0 1.0 1.0 1.0 1.0 1.0 1.0 1.0 1.0 1.0 1.0 1.0 1.0 1.0 1.0 1.0 1.0 1.0 1.0 1.0 1.0 1.0 1.0 1.0 1.0 1.0 1.0 1.0 1.0 1.0 1.0 1.0 1.0 1.0 1.0 1.0 1.0 1.0 1.0 1.0 1.0 1.0 1.0 1.0 1.0 1.0 1.0 1.0 1.0 1.0 1.0 1.0 1.0 1.0 1.0 1.0 1.0 1.0 1.0 1.0 1.0 1.0 1.0 1.0 1.0 1.0 1.0 1.0 1.0 1.0 1.0 1.0 1.0 1.0 1.0 1.0 1.0 1.0 1.0 1.0 1.0 1.0 1.0 1.0 1.0 1.0 1.0 1.0 1.0 1.0 1.0 1.0 1.0 1.0 1.0 1.0 1.0 1.0 1.0 1.0 1.0 1.0 1.0 1.0 1.0 1.0 1.0 1.0 1.0 1.0 1.0 1.0 1.0 1.0 1.0 1.0 1.0 1.0 1.0 1.0 1.0 1.0 1.0 1.0 1.0 1.0 1.0 1.0 0.0 0.0 0.0 0.0 0.0 0.0 0.0 0.0 0.0 0.0
G V P F F V N R G G L P V D E A T W E R M W K H V A K I H P D G E K V A Q R I R G A T D L P K I P I P S V P T F Q P S T P V P E R L E A V Q R Y I R E L Q Y N H T G T Q F F E I K K S R P L T G L M D L A K E M T K E A L P I K C L E A V I L G I Y L T N S M P T L E R F P I S F K T Y F S G N Y F R H I V L G V N F A G R Y G A L G M S R R E D L M Y K P P A F R T L S E L V L D F E A A Y G R C W H V L K K V K L G Q S V S H D P H S V E Q I E W K H S V L D V E R L G R D D F R K E L E R H A R D M R L K I G,C C C C E E C C C C C C C C H H H H H H H H H H H H H H C C C H H H H H H H H C C C C C C C C C C C C C C C C C C C C C C H H H H H H H H H H H H H H H C E C C C C E E C C C C C C C C E H H H H H H H H H H H H H H C C C E C H H H H H H H H H H C C C C C C C E E E E E E E E E E E E C C E E E E E E E E E E E E C C E E E E E C C C C C H H H C C E E E E E C C H H H H H H H H H H H H H H C C C E E E E E E E C C C C C C C C C C C C E C C C C C E E E E H H H H H H H H H H H H H H H H H H H H H H C C C,C C C C E E C C S C S S C C H H H H H H H H H H H H H H S T T H H H H H H H H T T C S S C C C C C C C C C C C C C T T S C H H H H H H H H H H H H H H H C B C C S S E E S S C C C T T S B H H H H H H H H H H H H H H C C C B C H H H H H H H H H H T T T T C T T E E E E E E E E E E E E T T E E E E E E E E E E E E T T E E E E E C C C S S G G G S C E E E E E S S H H H H H H H H H H H H H H T T C E E E E E E E C C C C C S C T T C C C B C C T T S E E E E H H H H H H H H H H H H H H H H H H H H H H C C C,1.0 1.0 1.0 1.0 1.0 1.0 1.0 1.0 1.0 1.0 1.0 1.0 1.0 1.0 1.0 1.0 1.0 1.0 1.0 1.0 1.0 1.0 1.0 1.0 1.0 1.0 1.0 1.0 1.0 1.0 1.0 1.0 1.0 1.0 1.0 1.0 1.0 1.0 1.0 1.0 1.0 1.0 1.0 1.0 1.0 1.0 1.0 1.0 1.0 1.0 1.0 1.0 1.0 1.0 1.0 1.0 1.0 1.0 1.0 1.0 1.0 1.0 1.0 1.0 1.0 1.0 1.0 1.0 1.0 1.0 1.0 1.0 1.0 1.0 1.0 1.0 1.0 1.0 1.0 1.0 1.0 1.0 1.0 1.0 1.0 1.0 1.0 1.0 1.0 1.0 1.0 1.0 1.0 1.0 1.0 1.0 1.0 1.0 1.0 1.0 1.0 1.0 1.0 1.0 1.0 1.0 1.0 1.0 1.0 1.0 1.0 1.0 1.0 1.0 1.0 1.0 1.0 1.0 1.0 1.0 1.0 1.0 1.0 1.0 1.0 1.0 1.0 1.0 1.0 1.0 1.0 1.0 1.0 1.0 1.0 1.0 1.0 1.0 1.0 1.0 1.0 1.0 1.0 1.0 1.0 1.0 1.0 1.0 1.0 1.0 1.0 1.0 1.0 1.0 1.0 1.0 1.0 1.0 1.0 1.0 1.0 1.0 1.0 1.0 1.0 1.0 1.0 1.0 1.0 1.0 1.0 1.0 1.0 1.0 1.0 1.0 1.0 1.0 1.0 1.0 1.0 1.0 1.0 1.0 1.0 1.0 1.0 1.0 1.0 1.0 1.0 1.0 1.0 1.0 1.0 1.0 1.0 1.0 1.0 1.0 1.0 1.0 1.0 1.0 1.0 1.0 1.0 1.0 1.0 1.0 1.0 1.0 1.0 1.0 1.0 1.0 1.0 1.0 1.0 1.0 1.0 1.0 1.0 1.0 1.0 1.0 1.0 1.0 1.0 1.0 1.0 1.0 1.0 1.0 1.0 1.0 1.0 1.0 1.0 1.0 1.0 1.0 1.0 1.0 1.0 1.0 1.0 1.0 1.0 0.0
P P A R K E K T K V K E S V S R V E K A K Q K S A Q Q E L K Q R Q R A E I Y A L N R V M T E,C C C C C C C C C C C C C C C C C C C C C C C C H H H H H H H H H H H H H H H H H H H H C C,C C C C C C C C C C C C C C C C C C C C C C C C H H H H H H H H H H H H H H H H H H H H C C,0.0 0.0 0.0 0.0 0.0 0.0 0.0 0.0 0.0 0.0 0.0 0.0 0.0 0.0 0.0 0.0 0.0 0.0 0.0 0.0 0.0 0.0 0.0 1.0 1.0 1.0 1.0 1.0 1.0 1.0 1.0 1.0 1.0 1.0 1.0 1.0 1.0 1.0 1.0 1.0 1.0 1.0 1.0 1.0 1.0 0.0
L L G Y N T V Q L W R M R R T A N K L M N G K L T T Q K E A A L K K W M A S Q Q D K F L A K W L K S S S V Y P D Q V Y S K L G L T K L G A S A K S S P N Y Q L Y E K Y T E A L L Q R W T N F K A S P D T V Y K S L R L D K L G A K A P Q S P S Y P M Y E K Y L Q T F F R N Q P A N,C C C H H H H H H H H H H H H H H H H H H C C C C H H H H H H H H H H H H H H H H H H H H H H H H C C C C C H H H H H H H C C H H H H H H H H H H C C C H H H H H H H H H H H H H H H H H H C C C H H H H H H H C C H H H H H H H H H H C C C H H H H H H H H H H H H C C C C C C,C C C H H H H H H H H H H H H H H H H H H C C C C H H H H H H H H H H H H H H H H H H H H H H H H C S S C C H H H H H H H T T H H H H G G G G G G S T T H H H H H H H H H H H H H H H H H H T C C H H H H H H H T T G G G G G G G G G G S T T H H H H H H H H H H H H C C C C C C,0.0 1.0 1.0 1.0 1.0 1.0 1.0 1.0 1.0 1.0 1.0 1.0 1.0 1.0 1.0 1.0 1.0 1.0 1.0 1.0 1.0 1.0 1.0 1.0 1.0 1.0 1.0 1.0 1.0 1.0 1.0 1.0 1.0 1.0 1.0 1.0 1.0 1.0 1.0 1.0 1.0 1.0 1.0 1.0 1.0 1.0 1.0 1.0 1.0 1.0 1.0 1.0 1.0 1.0 1.0 1.0 1.0 1.0 1.0 1.0 1.0 1.0 1.0 1.0 1.0 1.0 1.0 1.0 1.0 1.0 1.0 1.0 1.0 1.0 1.0 1.0 1.0 1.0 1.0 1.0 1.0 1.0 1.0 1.0 1.0 1.0 1.0 1.0 1.0 1.0 1.0 1.0 1.0 1.0 1.0 1.0 1.0 1.0 1.0 1.0 1.0 1.0 1.0 1.0 1.0 1.0 1.0 1.0 1.0 1.0 1.0 1.0 1.0 1.0 1.0 1.0 1.0 1.0 1.0 1.0 1.0 1.0 1.0 1.0 1.0 1.0 1.0 1.0 1.0 1.0 1.0 1.0 1.0 0.0 0.0 0.0 0.0
S H Y E E G P G K N I P F S V E N K W R L L A M M T L F F G S G F A A P F F I V R H Q L L K K,C C C C C C C C C C C C C C C C C H H H H H H H H H H H H H H H H H H H H H H H H H H H C C C,C C C C C S T T T S S S S C C S S H H H H H H H H H H H H H H H H H H H H H H H H H H H T T C,0.0 1.0 1.0 1.0 1.0 1.0 1.0 1.0 1.0 1.0 1.0 1.0 1.0 1.0 1.0 1.0 1.0 1.0 1.0 1.0 1.0 1.0 1.0 1.0 1.0 1.0 1.0 1.0 1.0 1.0 1.0 1.0 1.0 1.0 1.0 1.0 1.0 1.0 1.0 1.0 1.0 1.0 1.0 1.0 1.0 1.0 1.0
G S M A T V D P E K T L F L D E P M N K V F D W S N S E A P V R D A L W D Y Y M E K N S R D T I K T E E E M K P V L D M S D D E V K A L A E K V L K K L E,C C C C C C C C C C C C H H H C E H H H H C C C C C C C C E H H H H H H H H H H H H C C C C H H H H H H H H H H H H H C C H H H H H H H H H H H C C C C C,C C C C C S S C C C C C G G G S B H H H H C T T C C C C S B H H H H H H H H H H H H T T T C H H H H H H H H G G G G G C C H H H H H H H H H H H T C C C C,1.0 1.0 1.0 1.0 1.0 1.0 1.0 1.0 1.0 1.0 1.0 1.0 1.0 1.0 1.0 1.0 1.0 1.0 1.0 1.0 1.0 1.0 1.0 1.0 1.0 1.0 1.0 1.0 1.0 1.0 1.0 1.0 1.0 1.0 1.0 1.0 1.0 1.0 1.0 1.0 1.0 1.0 1.0 1.0 1.0 1.0 1.0 1.0 1.0 1.0 1.0 1.0 1.0 1.0 1.0 1.0 1.0 1.0 1.0 1.0 1.0 1.0 1.0 1.0 1.0 1.0 1.0 1.0 1.0 1.0 1.0 1.0 1.0 1.0 1.0 0.0 0.0
